25175	Rudy Giuliani found grinning during 9/11 ceremony	0
26335	Rudy Giuliani Suddenly Realizes He’s Been Grinning During Entire 9/11 Ceremony	1
22350	QUARTERBACK PLAYING WELL ENOUGH FOR COMMENTATOR TO forget HIS FAVORITE SANDWICH	0
22649	Quarterback Playing Well Enough For Commentator To Mention His Favorite Sandwich	1
17235	Twins Shocked to Score 2 Runs in Same Play	0
21175	Twins Shocked To Learn You Can Score 2 Runs In Same Play	1
25858	MANTI TE'O SCRAPES TOGETHER MORE THAN $5,500 FOR A COMBINE FEE	0
18671	Manti Te'o Scrapes Together $5,000 For Combine Fee	1
25742	study: majority of sloths boring	0
22783	Study: Majority Of Highlights Boring	1
10727	FATHER STILL HAS COMPLICATED SERIES OF FILE FOLDERS WITH DEAD SON'S NAME ON THEM	0
22002	Father Still Has Complicated Series Of File Folders With Grown Son's Name On Them	1
732	GEORGE FOREMAN RETIRES TO PROMOTE ITS OWN GRILL Hello jih 	0
19031	George Foreman Grill Retires To Promote Its Own Grill	1
11994	MAN WITH FOOD IN BEARD SAYING SOMETHING ABOUT FOOD	0
25006	Man With Food In Beard Saying Something About Climate Change	1
8674	CHARLOTTE BOBCATS GET LOST WHILE DRIVING TO AWAY GAME	0
25406	Charlotte Bobcats Get Lost While Driving To Basket	1
11838	MOTHER'S LITTLE Monster JUST MADE FUN OF CLASSMATE'S WEIGHT FOR 30 STRAIGHT MINUTES	0
21465	Mother's Little Angel Just Made Fun Of Classmate's Weight For 30 Straight Minutes	1
17363	BILL WATTERSON WRITES, ILLUSTRATES NEW 'CALVIN AND HOBBES' STRIP EACH MORNING 	0
21275	Bill Watterson Writes, Illustrates, Shreds New 'Calvin And Hobbes' Strip Each Morning Out Of Spite	1
6909	Home made vaccines are threatening pharmaceutical industry	0
27262	Pharmaceutical Industry Reeling As More Moms Making Vaccines At Home	1
1737	COMPANY'S SEXUAL-HARRASSMENT POLICY TARGETS OLDER EMPLOYEES	0
23630	Company's Sexual-Harrassment Policy Targets One Employee	1
22038	NATION SPEAKS OUT, JUST WANTS TO BE SAFE, HAPPY, RICH, COMFORTABLE, ENTERTAINED AT ALL TIMES	0
26117	Nation Just Wants To Be Safe, Happy, Rich, Comfortable, Entertained At All Times	1
25517	AL GORE PLACES INFANT SUPERMAN IN A SHIP TO ESCAPE KRYPTON FROM EXPLODING	0
24801	Al Gore Places Infant Son In Rocket To Escape Dying Planet	1
9987	JIM LEYLAND'S DAUGHTER TAKES OFF WORK TO HELP FATHER	0
20305	Jim Leyland's Daughter Takes Off Work To Help Father Through World Series	1
3545	EMOTICON TYPO PUSHES WOMAN SUICIDE	0
23200	Emoticon Typo Commits Woman To 2nd Date	1
19668	SMALL FLUFFY DOG TO BECOME MASCOT OF HOUSE OF VERSACE	0
24823	Small Fluffy Dog To Head House Of Versace	1
10133	Government shutdown costs U.S. Defense Industry $400 billion	0
26331	John Kerry Costs U.S. Defense Industry $400 Billion	1
25431	Dentist ON TV URGES MASS PURCHASE OF LISTERINE	0
22514	Man On TV Urges Mass Purchase Of Listerine	1
15920	FRANTIC STEVE JOBS STAYS UP ALL NIGHT DESIGNING APPLE launch	0
21982	Frantic Steve Jobs Stays Up All Night Designing Apple Tablet	1
22409	American people getting more wacky n wild	0
22373	Apathy Outpacing Lust As Leading U.S. State Of Mind	1
20961	SCIENTISTS CONFIRM HUMANS’ CLOSEST RELATIVE	0
27053	Scientists Confirm Statues Humans’ Closest Nonliving Relative	1
21591	GIRARDI UNSURE IF SABATHIA CAN WALK OUT TO MOUND ON 3 DAYS' REST	0
22699	Girardi Unsure If CC Sabathia Can Walk Out To Mound On 3 Days' Rest	1
16564	SCIENTIFIC BREAKTHROUGH REVEALS STARS CONSIST PRIMARILY OF HYDROGEN	0
25761	Scientific Breakthrough Reveals Stars Consist Primarily Of Twinkles	1
6503	JOSH SMITH CLAIMS HE ONCE SAW HAWK CARRY AWAY BASEBALL IN TALONS	0
22882	Josh Smith Claims He Once Saw Hawk Carry Away Basketball In Talons	1
898	CONSERVATION GROUP CRITICIZES WATERBOARDING AS WASTEFUL	0
24723	Conservation Group Condemns Waterboarding As Wasteful	1
8037	SMALL BUSINESS bigger THAN BUSINESS	0
20502	Small Business More Small Than Business	1
9354	MAN WHO LOST LEG TO terrorism DECIDES TO LET IT GO	0
23555	Man Who Lost Leg To Whale Decides To Let It Go	1
10273	'THIS IS THE HAPPIEST DAY OF MY LIFE,' LIES MAN HOLDING BEER	0
23158	'This Is The Happiest Day Of My Life,' Lies Man Holding Baby	1
17789	LONG-SNAPPER AND SON LONG-SNAP THOUSANDS BALLS AROUND BACKYARD	0
25174	Long-Snapper And Son Long-Snap A Few Balls Around Backyard	1
9019	ralph lauren LAUNCHES HUNGRY MAN LINE OF APPAREL	0
24182	Swanson Foods Launches Hungry Man Line Of Apparel	1
5802	GROUP OF CONGRESSMEN ENGAGE IN PASSIONATE, INCOHERENT DISCUSSION ABOUT CURRENT SYRIAN EVENTS	0
26160	Group Of Friends Engage In Passionate, Incoherent Discussion About Current Events	1
10057	FORMER 'MUNSTERS' STAR BUTCH PATRICK TO WRITE AUTOBIOGRAPHY ON TYPEWRITER BOUGHT AT YARD SALE	0
21458	Former 'Munsters' Star Butch Patrick To Write Autobiography On Word Processor Bought At Yard Sale	1
25698	OLYMPIC DISCUS THROWER NERVOUS ABOUT APPEARING ON TELEVISION FOR 4 SECONDS	0
19785	Olympic Discus Thrower Nervous About Appearing On Television For 14 Seconds	1
3718	GREG ODEN RECEIVING INTEREST FROM DALLAS MAVERICKS	0
26035	Greg Oden Receiving Interest From Dallas Office Depot	1
25386	bizarre New McDonald's ad asks whether beef itself is an expression of wanton lust	0
26800	‘And Yet, Is Not Beef Itself An Expression Of Wanton Lust?’ Bizarre New McDonald’s Ad Asks	1
1001	HUNDREDS OF REPUBLICANS APPROVE BILL TO DISCREDIT KERRY	0
24168	Hundreds Of Republicans Hurt In Rush To Discredit Kerry	1
18960	MCDONALD’S INTRODUCES NEW DOG PELLET	0
23246	McDonald’s Introduces New Feed Pellet	1
17935	christian bale visits sikh temple monks	0
19801	Christian Bale Visits Sikh Temple Victims	1
11135	Corporation rallies behind struggling community	0
22880	Community Rallies Behind Struggling Corporation	1
6499	Lockheed martin makes sear faces faster	0
25833	Lockheed Martin Engineer Told To Make It Sear Faces Off Faster	1
16416	POLITICIAN PLANNING TO SHATTER EUROPEANS' PRECONCEPTIONS OF AMERICANS	0
22488	Backpacker Planning To Shatter Europeans' Preconceptions Of Americans	1
17504	BASEBALL FAVORITE SPORT OF MANY DETROIT CITIZENS	0
19597	Report: Baseball Favorite Sport Of Many Detroit Tigers Players	1
22529	REDSKINS ASK ALBERT HAYNESWORTH TO GAIN 20 POUNDS	0
23284	Redskins Ask Albert Haynesworth To Gain 2,400 Pounds	1
14588	BOMB SQUAD MEMBER TAKES 7 HOURS TO DEFUSE SUSPECT PACKAGE	0
23961	Bomb Squad Member Takes 7 Hours To Open Birthday Present	1
15521	INSANE MAN GETS A LITTLE PERSPECTIVE BY REMINDING HIMSELF THAT HE IS dog	0
26695	Insane Man Gets A Little Perspective By Reminding Himself That He Is God	1
17771	people MURDERED BECAUSE OF THIS IMAGE	0
20012	No One Murdered Because Of This Image	1
26495	Afghan City claimed by U.S. forces retaken by Taliban after U.S. Marines withdraw	0
20771	U.S. Forces Take Over Key Afghan City That Will Be Retaken By Taliban When Marines Leave	1
2317	TACO BELL LAUNCHES NEW BURRITO	0
22061	Taco Bell Launches New 'Morning After' Burrito	1
4338	BREAKING: TIM TEBOW DRAWING criticism FROM MEDIA	0
26303	Breaking: Tim Tebow Drawing Interest From Media	1
13077	Patient's medication wears off halfway through surgery	0
25947	Juggler's Medication Wears Off Halfway Through Routine	1
20002	PLAYER'S SHORTCOMINGS LAID BARE BY FEMALE SPORTSCASTER	0
25370	Wife's Shortcomings Laid Bare By Female Sportscaster	1
21157	FAVORITE BASEBALL PLAYER A-ROD CRUSHED AT 9-YEAR-OLD REPELLENT SUSPENSION	0
26144	Repellent 9-Year-Old Crushed At Suspension Of Favorite Baseball Player A-Rod	1
6477	Words missing in a voicemail from his mom	0
19176	Voicemail From Mom Deleted 3 Words In	1
12215	LOST UKRAINIAN IMPRESSES AT OPEN-MIC NIGHT	0
23763	Lost Ukrainian Kills At Open-Mic Night	1
13656	SUSPENSION OF OFFICER GOES UNREWARDED	0
20700	Suspension Of Disbelief Goes Unrewarded	1
12728	Roger Goodell backs off expansion talk of Jacksonville Jaguars	0
18978	Roger Goodell Backs Off Expansion Talk After Being Reminded Of Jacksonville Jaguars	1
5299	BRITISH ROYAL FAMILY CONCERNED AFTER KING WILLEM II BEHEADS 7 TOURISTS	0
23799	British Royal Family Concerned After Queen Elizabeth II Beheads 7 Tourists	1
18877	REPORT: PACKERS AVERAGING LEAGUE-HIGH of 5.8 INJURIES PER PLAY	0
26154	Report: Packers Averaging League-High 5.8 Injuries Per Play	1
25968	AREA MAN GOING TO GO ON A DATE	0
19024	Area Man Going To Go Ahead And Consider That A Date	1
10066	ACCIDENT: 12-YEAR-OLD COULDN’T BEGIN TO GUESS NAME OF FRIEND WHOSE HOUSE HE VISITS TO PLAY XBOX	0
27024	12-Year-Old Couldn’t Begin To Guess Name Of Friend Whose House He Visits To Play Xbox	1
13577	AREA MAN NEVER MET BOX HE COULDN'T LIFT	0
24791	Area Man Never Met Cardboard Box He Couldn't Flatten	1
15005	COPS CLEARED ON CORRUPTION CHARGES AFTER IMPLICATING DECORATED POLICE SERGEANT	0
19331	Cops Cleared On Corruption Charges After Implicating Decorated Police Dog	1
9152	RESIGNING HOUSE LEADER CANTOR REFLECTS ON ALL THE ACCOMPLISHMENTS HE ACHIEVED	0
27385	Resigning House Leader Cantor Reflects On All The Accomplishments He Thwarted	1
5124	Paleontology class canceled	0
21072	Paleontology Class Winces Whenever Fundamentalist Kid Raises Hand	1
10029	SHOCKED DZHOKAR TSARNAEV ALWAYS THOUGHT HUMAN RESOURCES WERE GREAT JUDGES OF CHARACTER	0
25591	Shocked Dzhokar Tsarnaev Always Thought Classmates Were Really Great Judges Of Character	1
2232	CHILD'S EYELID ACCIDENTALLY NAILED TO WALL	0
25311	Bush's Eyelid Accidentally Nailed To Wall	1
706	1-SEED BRONCOS COACH THINKS TEAM HAS SHOT AT GOING ALL THE WAY	0
18774	Naive 1-Seed Thinks It Has Shot At Going All The Way	1
14757	MIRACLE OF SISTERS BORN 30 YEARS APART	0
26901	Adjacent Bowling Birthday Parties 30 Years Apart	1
16946	REPORTWAVING OBJECTS BEHIND BASKET HAS ONLY RESULTED IN 3 MISSED FREE THROWS IN NBA HISTORY	0
25857	Report: Waving Objects Behind Basket Has Only Resulted In 3 Missed Free Throws In NBA History	1
11909	Natives dance around bonfire to conjure spirit	0
26792	Nation’s Moms Dance Nude Around Moonlit Bonfire To Conjure Spirit Of Emma Thompson	1
24390	'Ghost Hunters' Enjoys Surprising 90% Success Rate	0
20882	'Ghost Hunters' Enjoys Surprising 100% Success Rate	1
24985	PRETTY GUY PLAYING HARD TO FOLLOW IN A COOKING RACE	0
19510	Pretty Lady Playing Hard To Follow	1
8549	EVERYONE IN THE FUTURE would EAT DIPPIN' DOTS	0
24391	Time Traveler: Everyone In The Future Eats Dippin' Dots	1
7892	EVIDENCE PILING UP IVANKA SLEPT WITH ONE OF HER COLLEGE PROFESSORS	0
25386	Evidence Piling Up Mom Slept With One Of Her College Professors	1
12987	MANAGER INSPIRES INTERNS WITH CLUBHOUSE READING OF CONTRACTUAL OBLIGATIONS TO PLAY OUT SEASON	0
26416	Manager Inspires Marlins With Clubhouse Reading Of Contractual Obligations To Play Out Season	1
22013	OBAMA SPENDS WEDNESDAY URGING	0
18809	Obama Spends Wednesday Doing Some Urgings, Some Callings On	1
1664	29-YEAR-OLD CONGRESSIONAL WHIZ KID BALANCES BUDGET	0
18737	14-Year-Old Congressional Whiz Kid Balances Budget	1
978	Congress overturns ban on gay marriage	0
24166	Congress Overturns Ban On Lawn Darts	1
26385	'With Binomials, Just Remember Foil', reports the self-appointed sex guard for teens	0
22656	'With Binomials, Just Remember FOIL,' Reports Man Keeping Teens From Having Sex Between 2:30 And 3:20	1
11842	SEAN PENN DEMANDS TO KNOW WHAT TRUMP IS DOING	0
22998	Sean Penn Demands To Know What Asshole Took SeanPenn@ gmail.com	1
9950	DOCTORS CONCERNED AS JOE BLANTON’S KNEE FLARES UP AGAIN	0
21862	Doctors Concerned As Joe Blanton’s Goatee Flares Up Again	1
16474	big, sloppy chicken parm now offered at wendy's 	0
26744	Big, Sloppy Chicken Parm Hovers Alluringly Above Nation	1
2431	GRAFFITI ARTIST COMPLETES MASTERWORK ‘STILL LIFE OF OBAMA’	0
25933	Graffiti Artist Completes Masterwork ‘Still Life Of Marijuana Leaf’	1
4797	JOHN KERRY POSES AS MASSEUSE TO have FEW MINUTES WITH PUTIN	0
27059	John Kerry Poses As Masseuse To Get Few Minutes With Putin	1
25133	STONE-HEARTED ICE skater FORGOES EXCLAMATION of sympathy	0
27265	Stone-Hearted Ice Witch Forgoes Exclamation Point	1
10005	at&t lays off 30,000 operators	0
23169	AT&T Lays Off 30,000 Automated Operators	1
21874	RESEARCHERS HAIL DISCOVERY OF NEW AB FOR FITNESS	0
23805	Fitness Researchers Hail Discovery Of New Ab	1
9055	RIGHT TO PRIVACY NOT GUARANTEED BY CONSTITUTION, SAYS SUPREME COURT JUSTICE	0
23312	Right To Privacy Not Guaranteed By Constitution, Says Supreme Court Justice Peeking In Bathroom Window	1
22209	OLIVE GARDEN WAITRESS COVERED IN Saliva SPRAYED FROM TALKING CUSTOMERS' MOUTHS	0
18748	Olive Garden Waitress Covered In Sauce Sprayed From Talking Customers' Mouths	1
21841	NEW LITTLE CAESARS MARKETING STRATEGY HAS EMPLOYEES THROW THEMSELVES ON PASSING CARS	0
19230	New Little Caesars Marketing Strategy Has Employees Throw Themselves On Hoods Of Passing Cars	1
17170	Roger Goodell tells Junior Seau’s family that head protection now a priority	0
19399	Roger Goodell Tells Junior Seau's Family To Throw Brain In His Trunk With The Rest Of Them	1
9277	'PEOPLE' MAGAZINE REPORTER HELD HOSTAGE BY yellow vest EXTREMISTS	0
23334	'People' Magazine Reporter Held Hostage By Timothy Hutton Extremists	1
26244	63-14 LOSS ends PENN STATE FOOTBALL team hopes	0
26578	63-14 Loss Disgraces Penn State Football Program	1
4395	hertz introduces short-term rental for driving around	0
22602	Hertz Introduces Short-Term Rental For Just Driving Around To Clear Head	1
1778	PAUL RYAN WONDERING IF HE SHOULD HAVE TOLD ROMNEY ABOUT the prostitute HE'S DATING	0
19841	Paul Ryan Wondering If He Should Have Told Romney About This Guy He's Dating	1
8156	EXTENSIVE INTERVIEW DISPELS ANY CONFUSION ABOUT BOSTON DUCK TOUR	0
20329	Extensive FAQ Page Dispels Any Lingering Confusion About Boston Duck Tour	1
6255	FILM SCHOOL BAD-MOUTHS FILM SCHOOL GRADUATE	0
20624	Film School Graduate Bad-Mouths Film School	1
12437	HALAL NOW AN OPTION	0
24191	Failure Now An Option	1
14014	KEVIN YOUKILIS TAKES OUT FULL-PAGE AD IN 'JUGGS' TO THANK ALL THE PEOPLE IN BOSTON	0
19738	Kevin Youkilis Takes Out Full-Page Ad In 'Juggs' To Thank All The Trim In Boston	1
1922	Police Assaulted at KID ROCK CONCERT	0
27353	Study Links Drinking While Pregnant To Being At Kid Rock Concert	1
8090	Dallas policeman CANnot REMEMBER EXACTLY WHERE HE WAS, WHAT HE WAS DOING when JOHN F. KENNEDY ASSASSINATED 	0
26632	Area Man Can Remember Exactly Where He Was, What He Was Doing When He Assassinated John F. Kennedy	1
22997	NEW REPORT SHOWS MANY U.S. BUSINESSES  JUST FRONTS FOR MONEYMAKING OPERATIONS	0
26698	New Report Shows Many U.S. Businesses Actually Just Fronts For Moneymaking Operations	1
18976	VIDEO SHOWN: KYLIE JENNER SMILES TO A RANDOM MAN IN A FOOTBALL GAME	0
20646	Study Links Adult-Male Smiling To Extremely Overweight Men Scoring Touchdowns	1
1576	FAILING INDUSTRIAL BASE MAKES BUFFALO BLEAKER THAN CINCINNATI	0
20306	WNBA Title Only Makes Indianapolis That Much More Bleak	1
5620	'SPORTS ILLUSTRATED' SENDS OUT PETER KINGS TO COVER NFL TRAINING CAMP	0
22922	'Sports Illustrated' Sends Out Army Of Peter Kings To Cover NFL Training Camp	1
2824	NEIGHBORS REMEMBER SERIAL KILLER AS unsuspicious	0
25263	Neighbors Remember Serial Killer As Serial Killer	1
22017	STUDY FINDS HEARING LOVED ONE'S VOICE INDUCES SEROTONIN IN COMA PATIENTS	0
18804	Study Finds Hearing Loved One's Voice Induces Excruciating Pain In Coma Patients	1
20050	George Bush to renew Kyoto treaty	0
24872	Bush Told To Sign Birthday Treaty For Someone Named 'Kyoto'	1
16415	USE OF ORGANIC PEANUT BUTTER ADDS TWO YEARS TO LOCAL MAN'S LIFE	0
24710	Use Of Organic Peanut Butter Adds Two Minutes To Local Man's Life	1
18174	NEW RUMOURS MADE BY COMMUNISTS, GRANDPA ALLEGES	0
23011	New VCR Made By Communists, Grandpa Alleges	1
25419	MESMERIZED KEVIN WARE CAN'T STOP WATCHING VIDEO OF HIS CHAIR BREAKING ON YOUTUBE	0
25485	Mesmerized Kevin Ware Can't Stop Watching Video Of His Leg Breaking On YouTube	1
8976	NATE SILVER VOWS TO TEACH CHildren tO READ	0
26230	Nate Silver Vows To Teach Chris Berman How To Read	1
21745	TIM DUNCAN TRYING TO GET MAN OFF DEATH ROW	0
22743	Tim Duncan Spends Free Time Trying To Get Wrongfully Incarcerated Man Off Death Row	1
15165	DEALERS PEDDLING STIMULANT PACKAGE DOOR-TO-DOOR	0
23215	Obama Peddling Stimulus Package Door-To-Door	1
6947	K-Y INTRODUCES NEW LINE OF COSMETICS	0
23190	K-Y Introduces New Line Of Jam	1
18492	SONG CRAFTED IN THE DEEPEST THOUGHTS OF MUSICIANS WINS BIG AT GRAMMYS	0
18527	Song Crafted In The Deepest Pit Of Hell Wins Big At Grammys	1
26188	Jimmy Hoffa fiasco leaves the nation admitting it's always a little bored	0
25881	Nation Admits It Always A Little Bored By Whole Jimmy Hoffa Thing	1
13547	JASON COLLIN MIGHT BE JUST THE FRONTCOURT PRESENCE TEAM TRYING TO BOOST MEDIA COVERAGE NEEDS	0
25654	Jason Collins Might Be Just The Frontcourt Presence Team Trying To Boost Media Coverage Needs	1
16437	CLEAN-SHAVEN JAMES HOLMES CHARMS COURTROOM IN LATEST APPEARANCE	0
25681	Clean-Shaven, Tuxedoed James Holmes Charms Courtroom In Latest Appearance	1
15744	BARACK OBAMA TO COME CLEAN ABOUT THE BASILISK PROJECT	0
25671	The Onion Urges Barack Obama To Come Clean About The Basilisk Project	1
14432	RUBIK'S CUBE SOLVED BY HAMMER	0
24518	Rubik's Cube Solved With Hammer	1
11003	FBI: TERRORISTS MAY BE CREATING NUCLEAR WEAPONS	0
20868	FBI: Muslims May Be Creating Nuclear Families	1
23498	REPORT: STUDY SHOWS NO ONE WILL STACK UP TO YOUR EX	0
27026	Report: No One Will Ever Stack Up To Your Eighth-Grade Boyfriend	1
4878	Kids love 'Elmo Ice Cream Truck'	0
26288	Mom Loved ‘Fruitvale Station’	1
19553	REPORT: U.S. EXPORTED 6 BILLION TONS OF CRUDE OIL LAST YEAR	0
26332	Report: U.S. Exported 6 Billion Tons Of Crude Web Content Last Year	1
14244	COWBOYS AWARD 6-YEAR, $108 MILLION EXTENSION TO SUPER BOWL–WINNING QUARTERBACK TONY ROMO	0
25488	Cowboys Award 6-Year, $108 Million Extension To Super Bowl–Watching Quarterback Tony Romo	1
4482	OBAMA: DEBT CEILING DEAL REQUIRED TOUGH CONCESSIONS BY BOTH DEMOCRATS AND republicans ALIKE	0
21179	Obama: Debt Ceiling Deal Required Tough Concessions By Both Democrats And Democrats Alike	1
8144	CREATIVE TEAM TO REVISIT PACMAN	0
25530	Creative Team To Revisit First Idea	1
21855	STATUE OF LIBERTY called TO SHUT DOWN today BUT NEW YORK wants STATUE	0
27144	Statue Of Liberty Corporation To Shut Down All But New York Flagship Statue	1
18288	MOTHER CAUGHT IN MIDST OF VERY PUBLIC NERVOUS BREAKDOWN	0
25957	‘I Don’t Know Who I Am Anymore, Little Buddy!’ Says Mother In Midst Of Nervous Breakdown	1
17994	DEVOTED lover STOPS BY GIRLFRIEND'S OFFICE TO DELIVER SURPRISE THREAT	0
18603	Devoted Abuser Stops By Girlfriend's Office To Deliver Surprise Threat	1
3591	NEW SOLAR SYSTEM DISCOVERED 4 LIGHT YEARS FROM EARTH	0
23142	New Solar System Discovered 4 Feet From Earth	1
19397	BOSS REALLY GETTING ON MAN'S ASS ABOUT FINISHING NCAA ANALYSIS	0
18770	Boss Really Getting On Man's Ass About Finishing NCAA Bracket	1
8068	ALUMNI MAGAZINE INCLUDED OBITUARIES FOR GRADUATION YEAR	0
19112	Alumni Magazine Flipped To Obituaries For Graduation Year, Discarded	1
21819	fat family has fat childrens	0
22877	Fat Family Has Fat Pets	1
16241	MIRACLE POWDER TURNS STAGNANT WATER INTO SAFE DRINKING WATER	0
24091	Miracle Powder Turns Water Into Delicious Fruity Drink	1
18194	COMMUNITY THEATER GIVES PART OF BLANCHE DUBOIS TO KATHY HAMILTON	0
27158	Community Theater Gives Part Of Blanche DuBois To Kathy Fucking Hamilton	1
7928	BOLD NEW CAMPAIGN REMINDS AMERICA Vegetables EXISTS	0
22463	Bold New Campaign Reminds America Beef Exists	1
21417	HUNTSMAN QUIETLY RELIEVED TO BE POLLING POORLY AMONG TOP VOTERS	0
21533	Huntsman Quietly Relieved To Be Polling Poorly Among GOP Voters	1
9553	FAMILY FANS OUT TO COVER MORE GROUND AT RALLY	0
21712	Family Fans Out To Cover More Ground At Buffet	1
8623	Priest helps MONTANA residents	0
24438	Gypsy Curse Lifted From Montana	1
7566	FILM TO BE MADE BY JOHN GRISHAM	0
25239	Film To Be Made Into John Grisham	1
22412	Metrosexuality a sin: Alabama Catholic Church 	0
24645	Catholic Church Condemns Metrosexuality	1
22198	NBA Committee Investigates Possible Allegations of traveling during a Game	0
24308	NBA Committee To Investigate Allegations Of Traveling During All-Star Game	1
15606	DEBATE RAGING AS TO WHETHER MICHAEL JORDAN OR LEBRON JAMES BEST TO EVER PLAY BASKETBALL	0
26987	Debate Raging As To Whether Michael Jordan Or LeBron James Biggest Asshole To Ever Play Basketball	1
24801	NEW POLL FINDS 86 PERCENT OF AMERICANS DON'T WANT TO HAVE RESTRICTIONS ANYMORE	0
22355	New Poll Finds 86 Percent Of Americans Don't Want To Have A Country Anymore	1
6332	SEA-MONKEYS CLAIMED AS VIRAL	0
23808	Sea-Monkeys Claimed As Dependents	1
19762	LOCAL DISC JOCKEY GENERAL URGES AMERICANS TO GET THE LED OUT	0
25753	U.S. Disc Jockey General Urges Americans To Get The Led Out	1
2986	TRUMP FAMILY FORCED TO DISCONTINUE PRINT EDITION OF CHRISTMAS NEWSLETTER	0
20482	Dunbar Family Forced To Discontinue Print Edition Of Christmas Newsletter	1
3460	Love is Blind ;)	0
22419	Mattress King Selects Wife From Small Wisconsin Village	1
18940	ARIZONA FIREMEN HELPING TO STOP CALIFORNIA WILDFIRE	0
24730	Arizona Burned To Stop California Wildfire	1
13650	ALUMNI MAGAZINE IS TIPTOEING AROUND CAMPUS SHOOTING	0
26535	Alumni Magazine Tiptoeing Around Campus Shooting	1
3452	Skinned career	0
27328	Working Artist Has Developed Thick Skin For Sound Career Advice	1
12363	ESPN DOCUMENTARY SHOWS HOME FOOTAGE OF YOUNG HARBAUGH BROTHERS COACHING TOGETHER IN BACKYARD	0
18446	ESPN Showing Home Footage Of Young Harbaugh Brothers Coaching Together In Backyard	1
7609	TOM BRADY CONSOLIDATES POWER BY MARRYING SISTER OFF TO KEVIN YOUKILIS	0
19006	Tom Brady Cruelly Consolidates Power By Marrying Sister Off To Twisted But Influential Kevin Youkilis	1
12116	China agrees to erase portion of U.S. debt	0
21114	China Agrees To Erase Portion Of U.S. Debt If Americans Dress Up In Costumes And Perform Silly Dance For Them	1
11463	PRICE OF GAS RISES TO FOUR DOLLARS PER GALLON	0
24808	Price Of Gas Rises To Four Expletives Per Gallon	1
19999	TV IN KITCHEN BROADCASTING THEFT OF TV IN LIVING ROOM	0
26776	TV In Kitchen Broadcasting Game 3 Seconds Behind TV In Living Room	1
17757	BUSH DIES PAINFULLY IN HIS CAR	0
23105	Bush Dies Peacefully In His Sleep	1
24995	5-YEAR-OLD Comforts LETS CRYING MOM by cleaning the house alone	0
26533	5-Year-Old Reluctantly Lets Crying Mom Sleep In His Bed Again	1
13445	Homaphobic HOSPITAL HOLDS 5TH ANNUAL GAYNESS CURE WALK	0
19875	Evangelical Hospital Holds 5th Annual Gayness Cure Walk	1
19824	TOMATO GENETICALLY MODIFIED TO BE MORE HEALTHY	0
22983	Tomato Genetically Modified To Be More Expensive	1
183	roger ebert hails human stain as 'a triumph'	0
25463	Roger Ebert Hails Human Existence As 'A Triumph'	1
6561	HUMANE SOCIETY VOLUNTEER SPENDS WHOLE MEETING TRYING TO SELL CAT	0
20352	Humane Society Volunteer Spends Whole Adoption Meeting Trying To Sell Family On Sicker Cat	1
1982	GEORGE R. R. MARTIN KILLS OFF ANOTHER CHARACTER	0
25835	George R. R. Martin Kills Off Whole Family	1
11245	miami heat unable to tell if victories are real or not	0
25812	Miami Heat Unable To Tell If Congratulations Are Sarcastic Or Not	1
1862	TONY DUNGY To Privately Coach REX RYAN	0
22577	Tony Dungy On Meeting With Rex Ryan: 'That Fucking Cocksucker Is A Good Shit'	1
25428	AREA MAN EXPERIMENTING WITH HOMOSEXUALITY FOR THE PAST EIGHT YEARS	0
24684	Area Man Experimenting With Homosexuality For Past Eight Years	1
8711	EPA SHUTS DOWN LOCAL ENTRAPMENT BUSINESS	0
24949	EPA Shuts Down Local Ghost-Entrapment Business	1
23910	NATIONALISTS OUTRAGED BY WHITE HOUSE SCANDAL	0
25672	Nation Supposes It's Outraged By White House Scandals	1
7156	TIGER WOODS, NIKE DEAL INCLUDES NEW LINE OF shoes AND APPAREL	0
25852	Tiger Woods, Nike Deal Includes New Line Of Sex Toys And Apparel	1
24391	MAN ROOTING FOR BOSTON BRUINS BECAUSE OF TERRORISM	0
25907	Man Rooting For Boston Bruins Because Of The Terrorism Thing	1
1594	ISRAELI ORTHODOX JEWS TO INTRODUCE 8-DAY-A-WEEK SABBATH	0
22333	CC Sabathia Involved In Bench-Clearing Nap 	1
13807	OBAMA NOT SURE HOW TO HANDLE SYRIA	0
21407	Obama Not Sure How To Handle Compliment	1
8681	'WE'RE IN THIS TOGETHER, YOU GUYS,' REPORTS NEWEST MEMBER OF government	0
22567	'We're In This Together, You Guys,' Reports Newest Member Of Crunch Gym	1
4752	SEYMOUR HERSH UNCOVERS NEW IDEA	0
23432	Seymour Hersh Uncovers New Thing Too Sad To Think About	1
9688	UNUSUAL NICKNAME TO FOREVER PREVENT PEOPLE FROM GETTING TO KNOW THE REAL DUMPTRUCK?	0
21117	Nickname To Forever Prevent People From Getting To Know The Real Dumptruck	1
10114	 MET HAVING TROUBLE SLEEPING IN NEW HOME	0
23420	Mr. Met Having Trouble Sleeping In New Home	1
725	BURGER KING AD CAMPAIGN APPEALS TO YOUNG, HIP DEMOGRAPHIC	0
24317	Ad Campaign Appeals To Young, Hip, Influenced-By-Ad-Campaigns Demographic	1
8115	WOMAN FEELS GUILTY AFTER SWITCHING HUSBANDS	0
23296	Woman Feels Guilty After Switching Brands	1
1997	NAKED WOMAN PICTURE lost POPULARITY ON INTERNET	0
24372	Naked Woman Picture Gains Popularity On Internet	1
19066	SOME OF AUDIENCE AT COLLEGE GRADUATION INVOLVED IN HEATED FAMILY ARGUMENT	0
25723	90% Of Audience At College Graduation Involved In Heated Family Argument	1
17452	CHEERLEADER SMILING	0
26516	Cheerleader Smiling At FOX Cameraman Presumably Crouched Right At Her Feet	1
7330	REPORT: 32% OF PRAYERS DEFLECTED OFF CHURCH	0
24376	Report: 32% Of Prayers Deflected Off Passing Satellites	1
7940	sales team transformation vision of giant robot sales tiger	0
23175	Sales Team Transforms Itself Into Giant Robot Sales Tiger	1
12016	BACKPACK OF FUN ACTIVITIES PACKED FOR KIDS	0
21357	Backpack Of Fun Activities Packed For Work	1
949	GAY COUPLE PUTS PRESSURE ON MARRY LAWS	0
24664	Gay Couple Feels Pressured To Marry	1
15086	4 GENERATIONS OF AMERICANS DEMAND RACISM REPARATIONS	0
25236	4 Generations Of Americans Demand Sitcom Reparations	1
23028	Struggling 'Pittsburgh Post-Gazette' Asks Social Media To Cover Penguin Playoff Series	0
23535	Struggling 'Pittsburgh Post-Gazette' Asks Sidney Crosby To Cover Penguin Playoff Series	1
16375	PATRIOTS BROADCASTER INSISTS AUDIENCE IS WATCHING A GOOD GAME	0
24605	Padres Broadcaster Insists Audience Is Watching A Good Game	1
22154	RAVENS ALREADY DREAMING RAY LEWIS CONSTANTLY BEING IN FOR REST OF SEASON	0
