20655	CAM NEWTON TIES NFL ROOKIE RECORD FOR MOST LOSSES	0
21390	Cam Newton Ties NFL Rookie Record For Most Losses In First 2 Games	1
21400	Elizabeth Warren still remembers names of every former student	0
27222	Gym Teacher Still Remembers Names Of Every Former Pantywaist	1
22899	Daughter thinks it's tim to have pet talks with parents	0
21623	Daughter Thinks It's Time To Have Sex Talk With Parents	1
1362	partially faded hand print undermining everything prosecutor claims	0
18335	Partially Faded Hand Stamp Undermining Everything Prosecutor Says	1
8724	'TRY GETTING OVER IT' ALL THERAPIST GOT	0
19143	'Try Journaling' All Therapist Got	1
25111	ATTEMPT TO RECREATE INCREDIBLE NIGHT OUT FROM HOMES WORKS PERFECTLY	0
20942	Attempt To Recreate Incredible Night Out From Youth Works Perfectly	1
13674	LONE PASSENGER HAS BEEN WAITING 36 HOURS FOR NEXT C TRAIN	0
20285	Lone Doofus Has Been Waiting 36 Hours For Next C Train	1
26296	Grandfather managed to make first fall as beautiful as possible	0
21317	Grandfather Tries To Make First Fall As Cool-Looking As Possible	1
6256	NOW THAT MAN HAS HEARD ABOUT HIM, HE SEES REFERENCES TO BARACK OBAMA ALL OVER THE PLACE	0
19799	Now That Man Has Heard About Barack Obama, He Sees References To Him All Over The Place	1
3782	GREG WARNER TO ATTEMPT COMEBACK AT FAMILY BARBECUE	0
22453	Uncle Greg To Attempt Comeback At Family Barbecue	1
12849	ELDERLY MAN CAN’T WAIT TO ERASE LIFETIME OF REGRETFUL MEMORIES	0
27448	Elderly Man Can’t Wait For Senility To Erase Lifetime Of Regretful Memories	1
11002	AMERICA SHOULD DEREGULATE DOMESTIC OIL DRILLING, REPORTS FOUNDATION	0
19179	America Should Deregulate Domestic Oil Drilling, Reports Foundation For Releasing Policy Papers Stating America Should Deregulate Domestic Oil Drilling	1
18284	YELP REVIEW SAYS IT’S JUST NICE TO EAT A MEAL AROUND OTHER PEOPLE	0
25466	Heartbreaking Yelp Review Says It’s Just Nice To Eat A Meal Around Other People	1
4546	WONDERFUL FATHER GETS THAT PROMOTION	0
21449	Terrible Father Gets That Promotion	1
16656	REALTORS BLAME HOUSING MARKET FOR SLUMP IN MANSION SALES	0
24610	Realtors Blame Housing Market For Slump In Creepy-Mansion Sales	1
3069	OLDER AMERICANS BARELY COMPREHEND CONVERSATION ABOUT MIDDLE EAST	0
24117	Uninformed Buffoon Barely Comprehends Conversation About Taylor Swift	1
3205	JUSTIN TIMBERLAKE TELLS JESSICA BIEL he WILL BELIEVE HER	0
26569	Justin Timberlake Tells Jessica Biel No One Will Believe Her	1
12450	'YOU DID GREAT!' ENTHUSIASTIC PERSONAL ASSISTANT TELLS CLINT EASTWOOD	0
19930	'You Did Great!' Terrified Personal Assistant Tells Clint Eastwood	1
8856	A'S PITCHERS MEET UP AT STORIED PITCHER HANGOUT CALLED 'THE STRIKE ZONE' AFTER GAME	0
19657	A's Pitchers Meet Up At Cool Pitcher Hangout Called 'The Strike Zone' After Game	1
6087	Police alerted by suspicious looking bag.	0
20784	Police Baffled By Bottle-Shaped Bag	1
24915	PEDIATRIC SURGEON LOVES WORKING WITHOUT PARENTS NEAR THE CHILDREN	0
18406	Pediatric Surgeon Loves Working On Children	1
4449	SHOOTING SUSPECT RELEASED AFTER QUESTIONING	0
20594	Shooting Suspect Released After Not Breaking Any Arizona Laws	1
5129	MOVIE STUDIO TO MAKE 'COYOTE UGLY' SEQUEL!	0
23469	Vindictive Movie Studio Threatens To Make 'Coyote Ugly' Sequel	1
8547	BLOODTHIRSTY GHOUL ADVOCATES HUMAN ORGAN CONSUMPTION	0
18911	Bloodthirsty Undead Ghoul Advocates Chocolate Cereal Consumption	1
8470	MEDIA HAVING TROUBLE FINDING RIGHT ANGLE ON DOUBLE-HOMICIDE	0
23406	Media Having Trouble Finding Right Angle On Obama's Double-Homicide	1
24071	NEWLY ENGAGED COUPLE RECEIVES INCREDIBLE OUTPOURING OF champagne FROM FAMILY, FRIENDS	0
27251	Newly Engaged Couple Receives Incredible Outpouring Of Insincerity From Family, Friends	1
22803	MARTHA BEANE OF USA SOFTBALL PUBLISHED HER BOOK 'MONEYSOFTBALL'	0
23924	'Billy Beane Of Office Softball' Profiled In Book 'MoneySoftball'	1
21624	TERROR EXPERTS WARN NEXT 9/11 COULD FALL ON A DIFFERENT DATE	0
23053	Terror Experts Warn Next 9/11 Could Fall On Different Date	1
6109	GROWN MEN INSPIRED BY SIGN HANGING IN LOCKER ROOM	0
21304	Grown Men Inspired By Stupid Little Sign Hanging In Locker Room	1
23933	18-YEAR-OLD DEMANDS RIGHT TO BE HARASSED IN THE WORKPLACE	0
23625	Area 18-Year-Old Demands Right To Be Sexually Harassed In The Workplace	1
22053	OLDER BROTHER CONS YOUNGER BROTHER HIM OUT OF $50,000	0
20011	Older Brother Playing With Younger Brother On Swing Set Will One Day Con Him Out Of $50,000	1
5269	FRESHMAN THINKING TO BREAK UP WITH HIGH SCHOOL TEACHER	0
26484	College Freshman Thinking It Might Be Time To Break Up With His High School Teacher	1
13528	KAY JEWELERS RECALLS 2 MILLION flawed WEDDING RINGS	0
27236	Kay Jewelers Recalls 2 Million Cursed Wedding Rings	1
16302	EMOTIONAL WAYNE LAPIERRE HONORS VICTIMS OF Gun violence	0
25437	Emotional Wayne LaPierre Honors Victims Of Background Checks	1
23727	Mechanical robots turn on their human overlords	0
24320	Mechanical Pencils Turn On Their Human Overlords	1
16720	RICK PERRY EXPERIENCES OVERWHELMING FEELING OF CLARITY AND CONTENTMENT IN FINAL MOMENTS BEFORE BIRTH OF CAMPAIGN	0
18841	Rick Perry Experiences Overwhelming Feeling Of Clarity And Contentment In Final Moments Before Death Of Campaign	1
2415	BREAKTHROUGH HEINZ BOTTLE SHOOTS KETCHUP WITH MORE PRECISION	0
24513	Breakthrough Heinz Bottle Shoots Ketchup With Laser-Like Precision	1
5018	RYAN HANDED ROMNEY'S LATEST POLITICAL UPDATES BEFORE WALKING ON STAGE	0
20172	Ryan Handed Romney's Latest Political Positions Before Walking On Stage	1
7040	Elementary school child chastised for acting like dog	0
22796	Dog Chastised For Acting Like Dog	1
8860	STUART SCOTT TELLS FRIENDS TO 'WATCH MY TWITTER' BEFORE TRYING TO GET INTO CHARLES BARKLEY'S PARTY	0
24368	Stuart Scott Tells Friends To 'Watch This' Before Trying To Get Into Charles Barkley's Party	1
1139	NEIGHBORHOOD KIDS GRANT LANDMARK STATUS TO HOUSE WHERE FRIEND KILLED HIMSELF	0
27200	Neighborhood Kids Grant Landmark Status To House Where Guy Killed Himself	1
11644	Taylor Swift Now Dating Tom Cruise	0
20531	Taylor Swift Now Dating Suri Cruise	1
6057	Horse-racing initiative aimes at training thoroughbreds from the inner city	0
22854	New Horse-Racing Initiative Aimed At Training Thoroughbreds From Inner City	1
19700	‘NO WAY TO PREVENT THIS,’ SAYS CITY WHERE THIS REGULARLY HAPPENS	0
27325	‘No Way To Prevent This,’ Says Only Nation Where This Regularly Happens	1
7841	MANNY RAMIREZ TO DAVID ORTIZ: 'HIT THE ROAD'	0
23556	Manny Ramirez To David Ortiz: 'Road Trip'	1
13074	NETFLIX: MOOD IN GOTHAM CITY ROGUES TRAINING CAMP UPBEAT	0
19817	Mood In Gotham City Rogues Training Camp Upbeat	1
15266	SEINFELD EPISODE A REPEAT	0
21302	Drunken Episode A Repeat	1
11921	RED SOX FIGURE IT'S WORTH IT TO JUST communicate with bud FOR PLAYOFF SPOT	0
22662	Red Sox Figure It's Worth It To Just Ask Bud Selig For Playoff Spot	1
1856	RON PAUL ELECTED ELECTED PREDIDENT ONLY IF US INHABITED BY RON PAUL CLONES	0
20326	Ron Paul Elected Ruler Of Planet Inhabited By 1 Billion Tiny Ron Pauls	1
6987	HAITI MAKES BID FOR 2024 OLYMPICS	0
23843	Haiti Makes Bid For 2216 Olympics	1
17622	OUR PREDICTION: WHICH OF THE 32 NFL TEAMS ARE UNDERDOGS HEADED INTO 2010 SEASON	0
22594	All 32 NFL Teams Announce They Are Underdogs Headed Into 2010 Season	1
1456	advice from 'the love guru' overheard	0
25212	Catchphrase From 'The Love Guru' Overheard	1
11497	College student gradually becomes an inspiration	0
23504	College Student Gradually Becomes Townie	1
24932	PSYCHIATRIST PATIENTLY LISTENS TO BECKHAM COMPLAIN ABOUT EVERY SINGLE AMERICAN	0
26200	Psychiatrist Patiently Listens To Obama Complain About Every Single American	1
15974	NETANYAHU FEELING LIKE TRIP TO Saudi Arabia  TO START WORLD WAR III WENT PRETTY WELL	0
20096	Netanyahu Feeling Like Trip To US To Start World War III Went Pretty Well	1
12795	'YOU’RE MINE NOW,' SMILING ROGER GOODELL WHISPERS WHILE POSING WITH AWARD	0
27259	'You’re Mine Now,' Smiling Roger Goodell Whispers While Posing With Jadeveon Clowney	1
12708	TWO-MINUTE RAIN SHOWER ALL IT TAKES TO DERAIL SHUTTLE LAUNCH	0
25531	Two-Minute Rain Shower All It Takes To Derail Trip To Gym	1
3047	IRAQIS ARMING THEMSELVES FOR INDEPENDENCE	0
21879	Iraqis Arming Selves For Independence	1
1027	 GROUNDHOG SEES SHADOW 	0
18481	Depressed Groundhog Sees Shadow Of Rodent He Once Was	1
3469	Formula One driver has great idea for tow-truck movie	0
22660	Tow-Truck Driver Has Great Idea For Tow-Truck Movie	1
17526	SUBSTITUTE TEACHER TOTALLY Rocks	0
21282	Substitute Teacher Totally Freaks	1
740	NEW COWBOYS STADIUM TO FIX HEAT PROBLEMS	0
26452	New Stadium To Fix Everything	1
8902	HILLARY RECEIVES 3 A.M. PHONE CALL FROM DRUNKEN trump	0
24415	Hillary Receives 3 a.m. Phone Call From Drunken Bill Clinton	1
6704	CHAIN GOES OUT OF BUSINESS	0
25568	'Everything's $10,000' Chain Goes Out Of Business	1
5388	MAN Does NOTHING BUT LUMBERING Benefits OF REWARDS CARDS	0
27383	Man Nothing But Lumbering Golem Of Rewards Cards	1
25749	shady cop moonlighting as terrorist just to make ends meet	0
21882	Iraqi Cop Moonlighting As Terrorist Just To Make Ends Meet	1
3119	MACHIAVELLIAN WHITE HOUSE INTERN GAINING INFLUENCE AMONG WEST WING STAFF	0
23596	Machiavellian White House Groundskeeper Gaining Influence Among West Wing Staff	1
6496	BEARS GIVING JAY XXXX A FEW YEARS TO PROPERLY HEAL	0
26653	Bears Giving Jay Cutler A Few Years To Properly Heal	1
24379	'GROSS' MISINFORMATION: DOCTOR RECOMMENDS DRINKING 8 WARM CUPS OF CLAM JUICE A DAY	0
18843	Gross Doctors Recommend Drinking 8 Warm Cups Of Clam Juice A Day	1
24253	here i am setting on my laptop screen wasting time	0
27477	Mom Starting To Fear Son’s Web Series Closest Thing She Will Have To Grandchild	1
591	NEW STUDY FINDS ONLY 88% OF GUITAR CENTER CUSTOMERS play guitar	0
26914	New Study Finds Only 88% Of Guitar Center Customers Become Famous Musicians	1
11515	HOLLYWOOD MAINTENANCE CREWS SENT OUT TO PATCH UP FILM INDUSTRY’S POTHOLES	0
27095	Hollywood Maintenance Crews Sent Out To Patch Up Film Industry’s Plotholes	1
3502	Abandoned Shopping Mall Retains Staff, Vestiges of Hope   	0
21167	Abandoned Mall Retains Eerie Vestiges Of Fun Shopping Atmosphere	1
4198	NEW LAW ENFORCEMENT ROBOT CAN WIELD FORCE OF 5 HUMAN OFFICERS	0
27344	New Law Enforcement Robot Can Wield Excessive Force Of 5 Human Officers	1
10974	NATION'S COUPLES HIT ROUGH	0
19612	Nation's Couples Hit Rough Spell	1
3971	MITT ROMNEY ADOPTS NEW ‘NO-NONESENSE’ PERSONA FOR DEBATES	0
20112	Mitt Romney Adopts New ‘Ronnie Ferocious’ Persona For Debates	1
6618	CLEVELAND BROWNS GEARING UP TO PUNT BALL DOWN OPPONENTS’ FIELD	0
25707	Cleveland Browns Gearing Up To Punt Ball Down Opponents’ Throats	1
16123	Urban women to finally experience unbearable loneliness after having her own place in woods	0
21157	Area Woman Excited To Finally Experience Unbearable Loneliness Of Having Her Own Place	1
11503	BRETT FAVRE PROMISES TO THROW BALL AS FAR AS HE CAN IN 2019 NFC CHAMPIONSHIP GAME	0
24216	Brett Favre Promises To Throw Ball As Far As He Can In NFC Championship Game	1
17291	DESPERATE NFL team NEEDS BIG WIN TO TURN SEASON AROUND	0
22741	Desperate NFL Needs Big Win To Turn Season Around	1
745	STUDY FINDS 90% OF ADOPTED CHILDREN’S ADOPTIVE PARENTS ARE UPPER CLASS	0
26743	Study Finds 90% Of Adopted Children’s Biological Parents Own Mansions	1
8791	REPORT: 80% OF SUBWAY TRACK REPAIRMEN RUN EACH DAY	0
25915	Report: 80% Of Subway Track Repairmen Run Over Each Day	1
7980	COOPER MANNING WINS SUPER BOWL ADVERTISING RIGHTS	0
24264	Cooper Manning Wins Super Bowl Of Energy Stocks Trading	1
12161	Action figure fights out of spite. See how he lost the sword	0
23156	Action Figure Fights On Despite Loss Of Dragon Sword	1
21156	20 killed , in the most drastic forest fire in Switzerland	0
23921	Andy Reid Carted Onto Field To Shake Hands With Sean Payton	1
17207	AMISH WOMAN REJECTED QUILT SALE THE MOMENT SHE SPOKE TO CHICAGO COUPLE	0
23889	Amish Woman Knew She Had Quilt Sale The Moment She Laid Eyes On Chicago Couple	1
9030	AL MICHAELS ASKS CRIS COLLINSWORTH IF THEY CAN DEBATE ABOUT SOMETHING OTHER THAN FOOTBALL	0
21378	Al Michaels Asks Cris Collinsworth If They Can Talk About Something Other Than Football	1
16771	JUSTICE SCALIA REJECTS NEW EASTON GAVELING GLOVES	0
20886	Justice Scalia Endorses New Easton Gaveling Gloves	1
11952	FEMALE FRIENDS SPEND RAUCOUS NIGHT BEATING THE LIVING SHIT OUT OF EACH OTHER	0
18990	Female Friends Spend Raucous Night Validating The Living Shit Out Of Each Other	1
18029	GIANT HOLE SWALLOWING UP YOUR HOUSE ADDED TO LIST OF THINGS TO WORRY ABOUT in Italy	0
18691	Giant Hole Swallowing Up Your House Added To List Of Things To Worry About	1
10862	HEALTH-FOOD-STORE WORKER DIES OF LUNG DISEASE	0
22573	Health-Food-Store Worker Dies Of Vitamin Lung	1
5527	Obama has a dream about the nation again	0
26591	Obama Has That Sex Dream About Nation Again	1
19960	ADDITIONAL FINDINGS SHOW A PENN STATE STUDENT KNEW ABOUT ONGOING CHILD MOLESTATION	0
19736	Additional Findings Show Every Penn State Student, Alumnus Also Knew About Ongoing Child Molestation	1
14063	NOBEL-WINNING FILLY AN INSPIRATION TO WOMEN WHO WANT TO WIN NOBEL	0
23533	Preakness-Winning Filly An Inspiration To Women Who Want To Win Preakness	1
16399	NATION STILL REELING FROM SURPRISE-SUCCESS OF 'MR. POPPER'S PENGUINS'	0
19767	Nation Still Reeling From Mega-Success Of 'Mr. Popper's Penguins'	1
6242	BOMB SQUAD ACCUSED OF USING POWER OF PEP FOR PERSONAL GAIN	0
24239	Pep Squad Accused Of Using Power Of Pep For Personal Gain	1
17030	ENTIRE NATION PICKS CANDIDATES	0
22113	Entire Nation Picks Same Bracket	1
25965	An agent decides to try out a phone in the future.	0
22100	Lazy Free Agent Wants To Try Out Over Phone	1
5679	THOUSANDS CHEER BALL'S PASSAGE THROUGH HOOP	0
24020	Millions Cheer Ball's Passage Through Hoop	1
24418	MIKE HOLMGREN FINALLY ADMITS HE'S WORKING FOR CLEVELAND BROWNS	0
19598	Mike Holmgren Finally Admits To Friends That He's Working For Cleveland Browns	1
9723	NATION'S SOCCER DROUGHT BECOMING INSUFFERABLE	0
22916	Nation's Soccer Fan Becoming Insufferable	1
4877	Dam built in the Nile river has been demolished by Islamic people	0
25227	Thousands Gather For Stuffing Of Giant Rockefeller Center Turkey	1
10370	REST OF WORLD NOT BITING ON GAY COUPLE’S OPEN RELATIONSHIP	0
27350	Rest Of World Not Biting On Couple’s Open Relationship	1
18838	US WOULD NOT BE SURPRISED AT THIS POINT IF CHRIS BROWN ALLEGEDLY TRAVELED BACK IN TIME AND PUNCHED ANNE FRANK	0
18464	Nation Would Not Be Surprised At This Point If Chris Brown Allegedly Traveled Back In Time And Punched Anne Frank	1
17571	REPORT: MANY IRAQIS STILL RAGING ABOUT U.S. INVASION	0
25829	Report: Many Iraqis Still Holding Petty Grudge About U.S. Invasion	1
4875	Airports at America changed toilets to 'Student Toilet' and 'Adult Toilet'	0
22506	Cult Divided On Whether To Let Women Become Telepathic-Vision Clerics	1
5799	Red Sox fan dedicates can on fire to marathon victims	0
26582	Red Sox Fan Dedicates Garbage Can He’s Lighting On Fire To Marathon Victims	1
8323	REAL MADRID NO MATCH FOR FC BARCELONA	0
19039	Great Team Chemistry No Match For Great Team Biology	1
8340	TRUMP REMINDS NOBEL AUDIENCE ABOUT CDS AVAILABLE FOR SALE IN LOBBY	0
26825	Macklemore Reminds Grammys Audience About CDs Available For Sale In Lobby	1
26023	GOVERNOR OF ALABAMA INJURED in cycling accident	0
22887	Governor Of Alabama Injured Imitating Pro Wrestling	1
14147	EVERY TEAM IN NFL CALLS BENGALS TO LET THEM KNOW THEY SUPPORT CARSON PALMER	0
20648	Every Team In NFL Calls Bengals To Let Them Know They Don't Want Carson Palmer	1
19078	PRODUCTION OF 'ICEMAN COMETH' CANCELED DUE TO ENTIRE CAST GETTING CALLED BACK FOR ADVERTISEMENT OPPORTUNITIES 	0
20931	Production Of 'Iceman Cometh' Canceled Due To Entire Cast Getting Called Back For Axe Body Spray Commercial	1
11109	Venerable 	0
25717	24-Year-Old Receives Sage Counsel From Venerable 27-Year-Old	1
21978	BOILERMAKERS PROTEST PURDUE PHARMA	0
24479	Boilermakers Protest Purdue's Mascot	1
4991	STUDY FINDS MAJORITY OF SHARK-RELATED FEARS UNJUSTIFIED	0
27114	Study Finds Majority Of Non-Shark-Related Fears Completely Unjustified	1
13328	COREY PAVIN ANNOUNCES PLANS TO GET FIT BEFORE RYDER CUP	0
22629	Corey Pavin Announces Plans To Get Loaded Before Ryder Cup	1
212	Area couple decides to avoid shopping during times of heightened passions	0
18875	Area Couple Vows Never To Go Dildo Shopping While Horny Again	1
17102	REPORT: GET BACK TO WORK	0
25834	Report: Get Back To Fucking Work	1
8413	BILL BELICHICK LEANING TOWARDS USING ROB GRONKOWSKI FOR FIRST TEAM	0
25536	Bill Belichick Leaning Towards Using Rob Gronkowski For Soup Stock	1
19825	SPRAYED RITZ CRACKER DUST BEAUTIFULLY ILLUMINATED BY GLOW OF TELEVISION	0
19220	Coughed Ritz Cracker Dust Beautifully Illuminated By Glow Of Television	1
9833	PAWN SHOP CUSTOMER PLANS TO BUY KEEPSAKE BACK	0
18789	Pawn Shop Customer Plans To Buy Toaster Back	1
14662	BASEBALL PLAYER WHOSE USEFULNESS HINGES ON CENTIMETER-WIDE ELBOW TENDON SIGNED WITH THE METS	0
27022	Baseball Player Whose Usefulness Hinges On Centimeter-Wide Elbow Tendon Signed To 10-Year Deal	1
16243	Eagles concerned by Nick Foles asking about contract dates	0
20540	Eagles Concerned By Nick Foles Asking About Best Ways To Tear ACL	1
6217	Study shows: 9% of plane landings just barely pulled off 	0
20654	Study: 90% Of Plane Landings Just Barely Pulled Off	1
9273	ROCK SONG TAKES geological STANCE	0
24199	Rock Song Takes Pro-Rock Stance	1
21467	NEW LAW FORCES CEOS TO FORGO RECEIVING MASSIVE BONUSES	0
22208	New Law Forces CEOs To Humbly Shrug Before Receiving Massive Bonuses	1
18108	KIM JONG IL SHOWS GIANT ROBOT	0
24461	Kim Jong Il Unfolds Into Giant Robot	1
22612	FANS STORM SENATE FLOOR AFTER PASSAGE OF BILL	0
24057	H.R. 2651 Fans Storm Senate Floor After Passage Of Bill	1
8180	ENTIRE NBA PLAYOFFS ON DVR	0
25824	Man With Entire NBA Playoffs On DVR Currently Halfway Through Heat-Bucks	1
6439	WATER PARK PROMISES MORE FUN THAN IT IS CAPABLE OF DELIVERING	0
23720	Water Park Promises More Fun Than Water Is Capable Of Delivering	1
8	NEW ECO-FRIENDLY HUMMER ENGINEERED to protect environment	0
24825	New Eco-Friendly Hummer Engineered To Kill Its Drivers	1
24140	DELL ACQUIRED BY GATEWAY 2000 IN MERGER OF 2 BIGGEST CLIENTS IN COMPUTER TECHNOLOGY	0
18516	Dell Acquired By Gateway 2000 In Merger Of 2 Biggest Names In Computer Technology	1
25514	"pHILLIES WILL WIN THE WORLD SERIES, NATION THINKS ""Yeah Right"""	0
25355	Phillies Win World Series, Nation Thinks	1
26072	ECONOMIST KEEPS CLOSE EYE ON GE STOCK VERSUS HEIGHT OF MEXICAN GDP	0
22151	Freakonomist Keeps Close Eye On GE Stock Versus Height Of Mexican Weightlifters	1
26073	GIRLFRIEND DUMPED ME AFTER FORWARDING PRO-LIFE LINK	0
24641	Girlfriend Dumped After Forwarding Stupid Link	1
5837	SOCIALLY ANXIOUS MEN UNABLE TO EXPLAIN CONTEMPT THEY FEEL FOR GROUP OF PEOPLE ENJOYING ONE ANOTHER'S COMPANY, STUDY SHOWS	0
21791	Man Unable To Explain Contempt He Feels For Group Of People Enjoying One Another's Company	1
22254	OPTIMISTIC NFL PLAYERS DISCUSSING FOR A PERFECT 0-16	0
20059	Overconfident Dolphins Already Talking About Going Perfect 0-16	1
20065	JERRY JONES THINKING ABOUT SIGNING MICHAEL VICK	0
25354	Jerry Jones Probably Thinking About Signing Michael Vick	1
17395	NEW ROBOT CAPABLE OF EMOTION	0
22492	New Robot Capable Of Unhealthily Repressing Emotion	1
12032	AIRLINE RAISES COSTS BY INEBRIATING PILOTS	0
23895	Airline Cuts Costs By Becoming Terrible Airline	1
19139	‘GAME OF THRONES’ SEASON 3 OPENS WITH CERCEI GETTING FINGERED WHILE DISCUSSING ARRIVAL OF WINTER	0
25465	‘Game Of Thrones’ Season 3 Opens With Every Character Getting Fingered While Discussing Arrival Of Winter	1
5118	diabetic patients' overuse of insulin is an issue for doctors	0
23396	Diabetic Roommate Uses All The Insulin Again	1
25107	MLB BANS MANAGERS FROM USING SPEAKER-TRICKS TO FORCE PLAYERS TO BE BETTER	0
27335	MLB Bans Managers From Using Electric Prods To Force Players Into Batting Cages	1
6103	DENNY'S INTRODUCES A 'BUCKET OF EGGS AND MEAT' IN THE BREAKFAST MENU	0
23248	Denny's Introduces 'Just A Humongous Bucket Of Eggs And Meat'	1
5156	‘WHAT IF WE PUT MARIHUANA ON TOP? WOULD THEY EAT THAT?’ DORITOS EXEC WONDERS OUT LOUD	0
26694	‘What If We Put M&M’s On Top? Would They Eat That?’ Doritos Exec Wonders Out Loud	1
20425	Carlos Beltran Has Impressive Day	0
20791	Carlos Beltran Has Impressive Day Of Not Falling Apart And Dying	1
23267	REPORT: MAJORITY OF PAY PHONE CONVERSATIONS BEGIN AFTER 9 PM	0
23493	Report: Majority Of Pay Phone Conversations Begin, End In Tears	1
21067	YOUTUBE CEO DEMANDS MORE WEB VIDEOS	0
19753	Blood-Drenched, Berserk CEO Demands More Web Videos	1
11986	'I MAKE MY OWN CHOICE,' SAYS MAN ABOUT TO GET FIRED	0
20802	'I Make My Own Hours,' Says Man About To Get Fired	1
7538	MAN WHO STAYED UP ALL NIGHT EATING MICE REFERS TO SELF AS NIGHT OWL	0
18798	Man Who Stayed Up Until Dawn Eating Mice Refers To Self As Night Owl	1
22925	JOE LUNARDI ENTERS DAY 10 OF CONTINUOUS, MONTH-LONG TRAINING	0
19183	Joe Lunardi Enters Day 10 Of Continuous, Month-Long Orgasm	1
21718	FATHER NAVIGATES REDUCED-RATE TRAVEL WEBSITES	0
19880	Dad Navigates Reduced-Rate Travel Websites Like Mozart Composing Symphony	1
987	REPORT: MAJORITY OF AMERICANS JUST NEED TO GET MOTIVATED AND DO IT	0
20831	Report: Majority Of Americans Just Gotta, You Know, Get Motivated And Do It	1
4704	AREA RESIDENT TRIES INDIAN FOOD	0
24611	Area Grandmother Tries Indian Food	1
12912	BENGALS FAN CONFIDENT THIS IS THE WAKE-UP CALL PACMAN JONES NEEDED	0
25855	Bengals Fan Confident This The Wake-Up Call Pacman Jones Needed	1
5100	MAN NEEDS VERBAL ASSURANCE THAT HAND STAMP WILL GET HIM BACK OUT	0
27470	Man Needs Verbal Assurance That Hand Stamp Will Get Him Back In	1
15613	SURVEY: IS SNAPPING THREE TIMES LEADING WAY TO RECALL MOVIES, ACTORS?	0
24316	Study: Snapping Three Times Leading Way To Recall Movies, Actors	1
15655	OBAMA DEEPLY CONCERNED AFTER SYRIANS GASSED TO DEATH	0
26224	Obama Deeply Concerned After Syrians Gassed To Death On White House Lawn	1
24768	CLOSING OF HOMELESS SHELTER LEAVES POOR STUDENTS WITH NOWHERE TO TURN	0
24569	Closing Of Homeless Shelter Leaves College-Application-Padding Students With Nowhere To Turn	1
9651	MICKEY MOUSE NOTICEABLY AVOIDS MUSLIM CHILD DURING TRIP TO DISNEY WORLD	0
24067	Mickey Mouse Noticeably Avoids A-Rod During Trip To Disney World	1
12493	BELGIUM'S LIBERALS WORRIED ABOUT THEIR CARBON FOOTPRINT	0
22229	Jupiter's Liberals Worried About Their Ammonia Footprint	1
6210	EAST CAROLINA GRADS DID NOT KNOW NORTH CAROLINA IS A STATE	0
23883	East Carolina Grad Thinks East Carolina A State	1
4095	Bay AREA HOMOSEXUAL SAVES FOUR FROM FIRE	0
24652	Area Homosexual Saves Four From Fire	1
4985	NO GAY PEOPLE ACTUALLY REFER TO SELVES AS 'SAME-SEX COUPLE'	0
25928	Report: No Gay People Actually Refer To Selves As 'Same-Sex Couple'	1
17134	NEIGHBORLY DAYS INN GUEST BRINGS WELCOME BASKET TO NEW PEOPLE ACROSS HALL, FOUND GUILTY OF POISONING 4	0
23091	Neighborly Days Inn Guest Brings Welcome Basket To New People Across Hall	1
15563	SIBLINGS GATHER AROUND POWERPOINT TO HASH OUT OFF-LIMITS TOPICS FOR SEX EDucation	0
26645	Siblings Gather Around PowerPoint To Hash Out Off-Limits Topics For Thanksgiving	1
18074	hundreds of secret arctic lairs exposed by melting ice caps	0
23886	Melting Ice Caps Expose Hundreds Of Secret Arctic Lairs	1
21740	GEORGIA WOMAN BECOMES REPUBLICAN VICE PRESIDENTIAL CANDIDATE	0
25332	Area Woman Becomes Republican Vice Presidential Candidate	1
4648	Area man accidentally signs up as a Latino 	0
23221	Area Man Accidentally Signs Up For AOL Latino	1
5231	STRUGGLING AMERICAN AIRLINES TO cut funding for AIR PASSENGER SERVICE, will not shut down 'AMERICAN WAY' MAGAZINE	0
20425	Struggling American Airlines To Shutter Air Passenger Service To Focus On 'American Way' Magazine	1
17606	MAN CAN'T CONTROL HIS FACE WHILE THINKING	0
25972	Area Man Loses All Control Of Face While Thinking	1
6366	NICKNAME PERSISTS IN SPITE OF TWITTER	0
19375	Nickname Persists In Spite Of Surgery	1
17885	PRESSURE OF SUSTAINING MOST OF THE WORLD TAKING ITS TOLL ON OBAMA	0
19769	Pressure Of Sustaining Most Of The World Taking Its Toll On Rice	1
25853	BRAWL HIGHLIGHTS DECADES OF TENSION BETWEEN CHINA AND RUSSIA	0
21267	Brawl Highlights Decades Of Tension Between China, Georgetown	1
18937	DAD RETURNS FROM BUSINESS TRIP WITH EXOTIC DISEASE FROM SUDAN	0
18738	Dad Returns From Business Trip With Exotic Gifts From Idaho	1
21995	Study shows 96% possessions of young girls are stickers 	0
21810	Only 4% Of Young Girl's Possessions Are Sticker-Free	1
14954	ADHD man has so many things he needs to get oh, look, 'tin cup' is on	0
22842	Busy Man Has So Many Things He Needs To Get Oh, Look, 'Tin Cup' Is On	1
3422	RHODE ISLAND VOTES TO MOVE 2008 PRIMARY EARLIER	0
24158	Rhode Island Votes To Move 2008 Primary To Tomorrow	1
13461	OBAMACARE HELPS UNINSURED AMERICANS OBTAIN INSURANCE	0
26468	Obamacare Helps Uninsured Americans Become Blindingly Enraged At Insurance Companies	1
16409	"TAMPA BAY RAYS: ""FUCK YOU, RACISTS"""	0
25133	"Tampa Bay Rays: ""Fuck You, Cubs"""	1
10162	NASCAR CONSIDERS SINGLE 21 MILE RACE FOR 2011 SEASON	0
22266	NASCAR Considers Single 21,500 Mile Race For 2011 Season	1
10130	BROKE DAD MAKES SON A SOAP BOX CAR FOR CHRISTMAS	0
24152	Broke Dad Makes Son A PlayStation 2 For Christmas	1
16654	PAUL RYAN KNOCKED OVER BY PACK OF FAN BOYS	0
19998	Paul Ryan Knocked Over By Pack Of Rambunctious Romney Boys	1
17608	MAN HOPING PEOPLE NOTICE HOW MANY people suffer from his condition	0
27228	Man Hoping People Notice How Many Folding Chairs He’s Carrying At Once	1
18028	THE next IPAD - 'WAIT TILL YOU SEE WHAT WE'RE DOING WITH THIS ONE'	0
22862	The iPad - Wait Till You See What We're Doing With This One	1
10443	OBAMA STANDS FIRM DURING SYRIA MEETING	0
26262	Obama Throws Up Right There During Syria Meeting	1
26291	ASIMOV'S FIRST LAW OF ROBOTICS TRASHED BY ROBOTS	0
22974	Robots Speak Out Against Asimov’s First Law Of Robotics	1
4287	AREA MAN HOPES TO SEE ROOMMATE'S GIRLFRIEND NAKED	0
