12108	same-store sales seen up 4.3 percent in december
12109	spotlight turns to central banks
12110	senate confirms 3 top justice department nominees
12111	wim wenders premieres pina bausch dance film in 3d
12112	randall carries u.s. cross-country hopes
12113	fast retailing's japan uniqlo sales jump in july
12114	russia's isinbayeva wins pole vault gold
12115	poland bans czech alcohol after deaths
12116	global leaders to vow action to ease recession
12117	snapshot - financial crisis - 0930 gmt
12118	global photo exhibit captures a day in life of world
12119	indian fx/debt factors to watch-may 17
12120	madoff stays out on bail, to get electronic monitoring
12121	bank of japan steps up efforts to ease credit crunch
12122	pakistan's zardari wants trade for restive regions
12123	emerging markets-latam falls as us gdp fans recession fears
12124	construction activity shrinks at record pace
12125	agency founded to shore up nuclear security
12126	u.s. consumer confidence barely above record low
12127	baghdad triple bomb kills 28
12128	french band phoenix rising on u.s. indie scene
12129	at least 7 african migrants die off yemen
12130	three years on, new orleans is a city divided
12131	motor racing-formula one bahrain grand prix starting grid
12132	volcker to head new economy panel: report
12133	india questions u.s. green energy incentives at wto
12134	tampa bay's jackson out one year for substance abuse
12135	u.s. to agree insider trading probes revamp soon: report
12136	u.s. says undecided on eastern europe missile plan
12137	distress m&a not for faint of heart
12138	cbi retail sales growth eases in october
12139	portugal telecom q2 profit falls 20 pct, in-line
12140	south carolina woman ranked as oldest american dies at age 114
12141	eu strengthens myanmar sanctions over suu kyi trial
12142	china's bocom says partner hsbc won't sell shares
12143	smith happy to bank on south africa's unpredictability
12144	u.s., russian satellites collide in space
12145	nestle buys kraft pizza business for $3.7 billion
12146	republicans cool to do not track web plan
12147	no stomach for market turmoil? thank your genes
12148	england dominates champions league prize money
12149	analysis-un's iran atom probe hostage to big power diplomacy
12150	inflation seen peaking in march - top official
12151	syrian forces shoot dead 30 in protests: lawyer
12152	time running out to make vp pick
12153	myspace to launch high school musical contest
12154	orissa appeals against halt order on posco
12155	u.s. to expand yemen's air forces to counter al qaeda
12156	world is happier place than 2007 - poll
12157	tradeweb: talk of bad treasury trade on system false
12158	jackson film crosses $100 million internationally
12159	imic signs chinese iron ore offtake agreement for nkout
12160	mexico smugglers ply sea route to california
12161	u.s. speculation on vp candidate rampant
12162	india raids living buddha over alleged illegal funds
12163	u.s. federal reserve to maintain aggressive policy stimulus amid soft data
12164	raytheon wins deal to develop u.s. navy's new electronic jammer
12165	obama asks congress to back new payments to elderly
12166	here's 5,000 pounds -- go and buy an electric car
12167	russian troops dismantle west georgia checkpoints
12168	green living: daryl hannah clings to bio-fuel convictions
12169	analysis-tennis-nadal's earning power may not match federer's
12170	oil falls on disappointing us jobs data
12171	pope canonizes leper saint damien, hailed by obama
12172	murdoch says uk tv advertising holding up
12173	iran seen to hand over nuclear reply to powers
12174	merck heart failure drug misses goals in study
12175	election poses new challenge to storm-hit northeast
12176	retailers shop direct and boots cut jobs
12177	high-cost aluminium plants to take pain
12178	barclays hires former citi exec for hk wealth arm
12179	exclusive: samsung in talks to settle eu antitrust case - sources
12180	romanian mining town suffers from its gold riches
12181	e-g8: sarkozy enlists tech a-list for web economy forum
12182	briefs 2-robson urges beckham to quit galaxy
12183	when the chips are down, singapore singles go dating
12184	tennis-federer eyes year-end top spot in london finale
12185	wall st. havoc deals blow to mobile phone makers
12186	cricket-south africa in charge against new zealand in first test
12187	tropical storm gustav dumps rain on haiti
12188	technology spurs growth of fantasy sports in u.s.
12189	dog poo stops discus champion's training
12190	amazon.com to sell wine online in u.s.: vintners
12191	dayanidhi maran quits over telecoms case - source
12192	nikkei falls to 8-month closing low on yen worry
12193	ubs highest-paid banker is u.s. brokerage head
12194	india's hari puttar caught in harry potter spell
12195	obama and palin battle over pet spending projects
12196	whiners or satirists? blog charts woes of dating wall st bankers
12197	no indication canada bird flu outbreak has spread
12198	first witnesses to speak at mubarak trial
12199	cigar smokers resist possible fda rules
12200	fireeye's debut signals red hot interest in cybersecurity
12201	feature-generation y: the new depression generation?
12202	stocks, euro take european elections in stride
12203	downturn may tighten mafia grip on italy's economy
12204	rep. stephanie tubbs jones dies of aneurysm
12205	warship in narrow escape ahead of olympic test
12206	russia plans 7,600 force in georgia rebel regions
12207	edf close to deal to buy british energy
12208	paris club congo debt deal set to go ahead: canada
12209	protesters make noise over thunder
12210	ge ceo immelt embraces software; vc andreessen embraces hardware
12211	mickelson set to play first event of 2010 at torrey pines
12212	goldman sachs gets subpoena from manhattan da
12213	oil dollars help houston dodge economic woes
12214	imf warns of financial meltdown; europe seeks unity
12215	flaps may not have extended on ill-fated spanair jet
12216	mohamed al fayed considering bid for pinewood
12217	euro zone crisis to widen climate fund gap: report
12218	bowlers put india and windies test on knife edge
12219	singapore's fullerton and japan's sbi launch new fund
12220	jobs blasts rivals as ipad sales disappoint
12221	sienna miller settles news corp phone snoop case
12222	gold drops as monetary tightening comment weighs
12223	only a third of terrorism arrests led to charges
12224	strong earthquake in indonesia waters - usgs
12225	new york jobs at risk if carmakers crash
12226	bin laden's driver was key conspirator, u.s. says
12227	restricted crowd for african champions league final
12228	killer herpes decimates young french oysters
12229	forex-dollar hits 10-mth low vs yen after fomc minutes
12230	sachin tendulkar reaches 14,000 runs in tests
12231	legal action considered over ex-rbs boss pension
12232	iran to fingerprint westerners in tit-for-tat move
12233	tax bill boosts reporting by banks, rich
12234	afghan and u.s. forces kill 25 taliban
12235	press digest - hong kong - dec 6
12236	uk emerges faster in q4 from deeper recession
12237	guantanamo charges were spray and pray
12238	motorola's jha plans 90-day review
12239	wci communities files for chapter 11 bankruptcy
12240	connecticut police hunt crony of accused ex-nfl star hernandez
12241	biggest drop in u.s. oil demand in 26 years
12242	hollande won't let berlin deter his growth drive
12243	captain cook charts england victory in dhaka
12244	lch.clearnet piles into european cds clearing
12245	miles driven in june down 12.2 billion: government
12246	sports leagues will feel some of u.s. economy's pain
12247	u.s. senate panel votes to extend security law
12248	ny budget has $2.1 bln deficit in 1st 3 mths--gov
12249	warfarin may be underused to prevent strokes
12250	scientists tune into blue whale songs with defense technology
12251	swiss defago runs away with men's downhill
12252	four turkish soldiers die in helicopter crash
12253	french intelligence queried over al qaeda shooter
12254	climate change negotiators see no major durban deal
12255	wales coach admits team has a lot to do to retain title
12256	spd foreign minister to fight merkel in german poll
12257	economy likely to grow at 7 pct this year - manmohan singh
12258	u.s. senate confirms petraeus as cia chief
12259	older adults get hiv diagnosis later, die sooner
12260	american wife of tetra pak heir found dead in london
12261	stock index futures inch higher as m&a in focus
12262	yuan revaluation would yield limited u.s. benefits
12263	financial crisis enters lexicon with toxic debt
12264	back up messi claim and smile, mancini tells balotelli
12265	bofa silence on merrill losses may prompt lawsuits
12266	european developers avoid unlucky homes to tap far east demand
12267	myspace: 90,000 sex offenders removed in two years
12268	ex-pm hasina followers win bangladesh local vote
12269	oil spill aftermath: a tale of three plaintiffs
12270	london's chinatown immune to beijing excitement
12271	tampa, seattle, chicago most caffeinated u.s. cities
12272	geithner: need stimulus, not financial transactions tax
12273	u.s. may alert americans to be vigilant in europe
12274	french and malian forces hunt journalists' killers
12275	candidates make final pitch on eve of japan election
12276	dengue outbreaks on the rise in asia-pacific - who
12277	atlanta protesters regrouping after arrests: spokeswoman
12278	special report - southern sudan: oil boom to bust-up?
12279	eu agency starts infringement procedure on roche
12280	11 iraqi soldiers killed in bomb disposal accident
12281	gatwick may struggle to find serious buyer
12282	angola to hold elections every 4 years
12283	sanofi india eyes combiflam cream launch in january - exec
12284	overhaul needed to stop talent drain, says champagne
12285	lowry and arnold miss cut on pro debuts
12286	at least 20 dead as north mali factions clash
12287	china villagers protest solar plant pollution
12288	senators seek antitrust probe of ups/dhl plan
12289	japan to switch off nuclear power, may be some time before it's on again
12290	asian stocks give up early gains on global woes
12291	trina solar second-quarter earnings soar
12292	senegal making progress on graft, governance -u.s.
12293	janet jackson hospitalized before montreal show
12294	exercise shows opposing effects on appetite
12295	station alarms delay second spacewalk
12296	arkema to sell tin stabiliser unit
12297	china plays down google dispute but u.s concerned
12298	baluch group says holds american hostage in pakistan
12299	samsung sees better lcd performance; no big investments
12300	young chinese workers seek end to eating bitterness
12301	william and kate set up royal wedding charity fund
12302	sterile mosquitoes use sex to kill in dengue trial
12303	capital research wants yahoo vote probe
12304	american crane moves one ahead at torrey pines
12305	justice wants publisher information on google deal-wsj
12306	u.s. house begins assembly of financial reform plan
12307	wachovia, affiliates sued over bond fund losses
12308	lehman's fuld to testify at congressional hearing
12309	annan to meet assad, seeking end to syria violence
12310	pandas thriving despite earthquake devastation
12311	obama's use of fear card may backfire
12312	canada employment picks up steam in april
12313	smoke from russian wildfires reaches kazakhstan
12314	indian shares fall as profit sales continue; banks down
12315	nato chief: u.s. operation against bin laden justified
12316	sensex ends at 1-mth high on global stimulus hopes
12317	24 million customer accounts hacked at amazon's zappos
12318	golf-pga-valhalla dilemma for ryder cup captain azinger
12319	nokia buys german mobile software firm
12320	blast inside nato helicopter kills one in afghanistan
12321	lebanese calls for arabs to embrace iraq
12322	cern to resume search for big bang secrets
12323	eu regulators may take us fine against barclays as precedent
12324	interview-golf-ochoa wants more latinas on lpga circuit
12325	cindy mccain fits the role of first lady
12326	japan's aso raises hackles with nazi comment
12327	games attract record viewers and internet a hit
12328	new zealand name tri-nations team to play australia
12329	mobile email firm visto buys rival from motorola
12330	harlequin exhibit documents a woman's changing world
12331	lockheed, union in tentative pact to end strike
12332	top iranian reformer to challenge ahmadinejad, reports say
12333	commentary: killing of immigrant a senseless, barbaric act
12334	princes harry and william begin african charity rally
12335	best of the west: national park beaches
12336	gop launches calls attacking obama on ayers, national security
12337	show pages - state of the union with john king
12338	missile truck tips in latest air force mishap
12339	tours offer glimpse of sea turtle nesting
12340	elizabeth taylor hospitalized; cause unknown
12341	destroyer nears oil tanker seized by somali pirates
12342	commentary: dilbert guy's economic poll on mccain, obama
12343	senate to begin final sotomayor debate
12344	goosen takes one-shot lead in bridgestone
12345	al qaeda: air strike killed escapee
12346	uk pm gordon brown in kabul for karzai meeting
12347	is recovery for real? this week should provide key clues
12348	mccain: 'new 9/11' less likely now than after attacks
12349	boyd turns his back on burley's scotland
12350	palin thanks hometown as last day in office approaches
12351	visitors evacuate florida keys as fay nears cuba
12352	illinois republicans want perjury probe for burris
12353	borger: helping the bad guys to save ourselves
12354	japan pm to reshuffle cabinet
12355	michigan solar car team wins 2,400-mile race
12356	multibillion-dollar experiment to probe nature's mysteries
12357	key militant-held town falls to somali forces
12358	official tells lawmakers fema will fix aid distribution gaffes
12359	'star wars' creator attacks clones
12360	bayern's podolski hits hat-trick in japan
12361	pro-tibet demonstrators rally outside u.n.
12362	deadly dorm collapse in central turkey
12363	report: anthrax suspect kills self before filing of criminal charges
12364	ioc agenda: net censorship, doping, smog
12365	u.s. economy sees moderate growth
12366	out of the kitchen, into the priesthood
12367	engine fault blamed for russian air crash
12368	commentary: the obama-palin dream ticket
12369	yearly euro inflation at record high of 4.1%
12370	sharapova pulls out of beijing olympics
12371	man arrested in youtube baby food poisoning threats
12372	world no.1 ivanovic crashes out in montreal
12373	more authors turn to web and print-on-demand publishing
12374	lee rigby murder: how islamist hate narrative inspired killers
12375	ba profits hit by soaring fuel prices
12376	focus on the family's james dobson steps down
12377	premature babies in katrina's path torn away from parents
12378	antigua honeymoon attack survivor flown home
12379	bbc suspends top celebs in row over abusive broadcast
12380	bloomberg gains support on term-limit law changes
12381	polar bear attacks woman at berlin zoo
12382	countdown: top 10 reasons we love dick clark
12383	arsenal to take on mcclaren's fc twente
12384	coming soon: 'wallet phones' from japan
12385	electronic nose could spark end of sniffer dogs
12386	man due in court charged with defacing portrait of queen elizabeth ii
12387	complete list of academy award winners and nominees
12388	blatter: ronaldo is not a 'slave'
12389	8 seriously injured when bus carrying church group rolls over
12390	u.s. student, husband among dead in embassy attack in yemen
12391	warner bros. sues over 'hari puttar' film
12392	report: anthrax suspect kills self as fbi closes in
12393	cities scramble as business travel declines
12394	comedian steve harvey: women's standards too low
12395	yemen: militants attack military, police installations, kill 26
12396	hamas arrests more fatah members
12397	are we heading for a human-powered future?
12398	'hurricane chaser' ready to film ike's landfall
12399	comment: judge takes firm stance with karadzic
12400	bradman's bat fetches record $121,000
12401	son of ryan o'neal, farrah fawcett arrested on drug charges
12402	researchers aim to 'print' human skin
12403	beer lovers: what would jesus brew?
12404	poll: concerns about terrorist attacks at lowest level since 9/11
12405	amanpour: obama's call to arms and optimism
12406	photo project gives voice to 'backbone of america'
12407	should you be invited to my wedding?
12408	commentary: us health costs out of control
12409	lou dobbs: issues, tv, radio, and books
12410	california police: four officers shot in oakland
12411	clinton on stimulus: 'it's quite a good bill'
12412	how one busy mom found her inner peace
12413	global tourism feels the squeeze
12414	top intel officer slams work of u.s. spies in afghanistan
12415	official: 3 cholera victims in new york have recovered
12416	hamilton resumes f1 dominance in hungary
12417	cleric: karzai sought help to mediate afghan taliban talks
12418	zakaria: islamic world should learn from turkey court ruling
12419	five nato-led soldiers killed in afghanistan
12420	pakistan denies 'hellacious' bomb accusation
12421	nation's bridges, roads still 'structurally deficient'
12422	french legend thuram announces retirement
12423	supreme court to hear case about indecent speech on tv
12424	chinese plea for politics-free games
12425	taliban commander believed dead in airstrike
12426	spinal tap takes off the wigs
12427	england call up haskell for springboks test
12428	awake patient reads aloud during brain surgery
12429	lawmaker linked to attacks, iraqi authorities say
12430	getting a sugarland rush of energy
12431	political author's name matches name on terrorist watch list
12432	beijing prepares for influx of foreigners
12433	owen scores dramatic manchester derby winner
12434	mom on youtube begs ex to return girl
12435	'you don't forget': medic's holocaust diary tells story of hell
12436	amanpour: world welcomes obama with open arms, demands
12437	'twist' is most popular song of billboard era
12438	obama says mccain race card attack 'typical'
12439	mccain plays risky game with negative ads, author says
12440	panamanian official killed in robbery crossfire
12441	impressive loeb takes finnish rally lead
12442	five things never to do to your car
12443	oh, yes it's ladies' night, judge rules
12444	commentary: race shouldn't dominate campaign
12445	analysis: is mccain finding his way on faith?
12446	two sides of scientist emerge after suicide
12447	jury seated in o.j. simpson trial
12448	australia set tough task to save india series
12449	race car driver: we mourn, and must go on
12450	sex offender out on bond ordered into custody
12451	global protests over iranian crackdown
12452	uk hostages confirmed dead after bodies identified
12453	u.s. denies reports of al qaeda no. 2's illness or death
12454	smartphones to go: five apps you'll want to pack
12455	werder fight back to send milan spinning
12456	warehouse shooting leaves 2 dead in pennsylvania
12457	singh takes one-shot lead at bridgestone
12458	americans take 3-1 lead in ryder cup
12459	florida watches for fay's next move
12460	will 'green' movement kill the meal tray?
12461	recent fighting threatens ceasefire in sri lanka
12462	104 retired military brass against 'don't ask-don't tell'
12463	all blacks avenge wallabies defeat in auckland
12464	wie wilts in reno to miss men's cut again
12465	5 die in gym shooting near pittsburgh
12466	texts, threats led to mistaken identity killing, police say
12467	3 rockets fall in northern israel; gaza fighting continues
12468	summit weighs new global economy rules
12469	shamed rocker glitter denied hong kong entry
12470	tricky chile star makes blackburn move
12471	push to reopen civil rights-era cold cases stalls
12472	child brings bomb into northern ireland school
12473	not so fast, junior! device will help parents limit teen drivers
12474	cheney bashes russia for 'brutality' in georgia
12475	turkey bombs suspected kurdish rebel targets in iraq
12476	actor who played killer charged in real-life whodunit
12477	celebrity diet tricks that work (and two that you should avoid)
12478	users baffled as zune mp3 players freeze up
12479	'the boss' to play super bowl halftime
12480	7 in palin's administration agree to give statements in probe
12481	germans perform world's first double-arm transplant
12482	was anthrax suspect model citizen or menace?
12483	nasa greenhouse gas satellite fails
12484	13 arrested in istanbul bombings
12485	commentary: schwarzenegger's full view on palin's readiness
12486	obama on pocketbook issues beating palin pick in battle of 'burbs
12487	organizers reveal race route for 2009 giro
12488	obama says offshore drilling stance nothing new
12489	judge berates student's killer, gives him life
12490	palin asks state board to take over trooper probe
12491	smith's ton gives proteas historic series win
12492	kenyan police accused of widespread killings
12493	erviti pips roche to claim vuelta stage
12494	the 'unfathomable' arrest of a black scholar
12495	150 fatah supporters enter israel after hamas takes over east gaza
12496	new canon powershot tops itself
12497	chris brown and rihanna record duet
12498	nasa faults equipment in columbia shuttle disaster
12499	reports: 6 die as georgia shells south ossetia
12500	gunman's bloody trail leads to six bodies
12501	obama, congressional gop to discuss stimulus plan
12502	syria rejects israeli referendum law for ceding annexed land
12503	madagascar opposition leader declares himself in charge
12504	alaska senate race still uncertain after primary elections
12505	source: virginia congressman vetted for mccain running mate
12506	bomb kills 15 women street cleaners in mogadishu
12507	belgium paradise for beer lovers
12508	cibulkova continues fine run in montreal
12509	leaky toilet exposes corrupt china official
12510	ex-bush speechwriter: obama achieved little on overseas trip
12511	ireporters say obama won second debate
12512	flags in navy yard shooter aaron alexis' past perhaps not red enough
12513	israeli pm olmert declares intent to resign
12514	why obama is visiting israel
12515	somali pm: resignations will not topple govt.
12516	bus crash kills 12 in egypt
12517	burris reportedly will not seek senate seat in 2010
12518	duminy leads south africa fight back at mcg
12519	commentary: time for dialogue on race is now
12520	68 killed in india temple stampede
12521	inter in swoop for porto winger quaresma
12522	report: rapper t.i. reports to arkansas prison
12523	zimbabwe inflation hits 11,200,000 percent
12524	pakistan: 9 feared dead after k-2 avalanche
12525	minorities are not looking for 'payback'
12526	al qaeda: weapons expert among dead 'heroes'
12527	diplomat: russia stalling over georgia observers
12528	rain halts england's ashes charge
12529	korean continues asia's women's golf reign
12530	israel won't stop housing project in muslim neighborhood
12531	slow change frustrated young obama, friends say
12532	somalia bomb kills 21 women street cleaners
12533	10 best foods for your heart
12534	angelina jolie asks thai government to aid refugees
12535	her success against odds inspires singer john legend
12536	space spotlight: the great barrier reef, seen from space
12537	'dark knight' no. 1 again, nears $400 million mark
12538	israeli policeman arrested after palestinian boy's death
12539	'era of open government' behind information policy reversal
12540	community colleges are focus of white house summit
12541	widely distributed death photo of osama bin laden is fake
12542	russian dissident, novelist solzhenitsyn dead
12543	greek man held after girlfriend beheaded
12544	attacks give indie hit a tragic undertone
12545	cheney defends 'alternative' interrogation techniques
12546	bush to announce iraq troop reduction
12547	house apologizes for slavery, 'jim crow' injustices
12548	denver paper latest victim of declining readership, ad revenue
12549	no deal in sight as shutdown approaches third week
12550	bush travels to asia for talks, olympics
12551	murray beats djokovic, wins first masters
12552	terror-hit mumbai hotels to reopen
12553	brazil's vale spends $1.6b for ore ships
12554	singh wins world golf championship
12555	u.s. journalists to be tried in n. korea
12556	commentary: how u.s. should respond to mumbai attacks
12557	train collision probe to examine text messages
12558	accused courthouse killer's hostage testifies
12559	commentary: astonishing day for gm, america
12560	down economy spares no one, including the rich
12561	passenger: 'it seemed like it lasted an eternity'
12562	return to the homeland: a journey across china
12563	man presumed dead since '76 found -- alive
12564	murray: 'i'm ready to win wimbledon'
12565	all blacks rally to retain tri-nations title
12566	russia: troops staying in georgia breakaways
12567	path of peace available to north korea, obama says
12568	photos and maps of hurricane ike
12569	tseng's tragedy hands hull first lpga title
12570	the new hungry: college-educated, middle-class cope with food insecurity
12571	ireland nationalizes anglo irish bank
12572	spain facing zero growth as economy suffers
12573	argentine romero wins u.s. senior open
12574	gustav, near landfall, could park over northeast texas
12575	greece: suspected cleaver killer in critical condition
12576	turkey: 3 charged over fatal dorm collapse
12577	van der vaart agrees $20m real madrid move
12578	iran's nuclear power plant: threat or distraction?
12579	palin vows to shake things up; biden blasts gop call for change
12580	sources: blackwater-guard charges unveiled monday
12581	group accuses israel of pushing ill palestinians to spy
12582	brown calls for eu unity over russia
12583	texas braces as tropical storm warnings cover coast
12584	nazi suspect demjanjuk arrives in germany
12585	commentary: will u.s. find bin laden?
12586	snow causes more headaches for travelers
12587	cusack says new film finds happy medium
12588	'gossip girl,' jonas brothers win teen choice awards
12589	england brush aside kazakhstan in almaty
