16849	ny-based grocery chain yanks alec baldwin tv ads
16850	homeless victim of taped nj beating enters rehab
16851	report: swiss bank chief profited by dollar trades
16852	uk demands data on breast implant ruptures
16853	usd's peleti: a 'reject' who proved many wrong page 1 of 2
16854	dutch urged to apologize for jewish deportations
16855	paul: iowa showing good enough to keep him in race
16856	ex-west texas priest gets prison in sex abuse case
16857	strieber says brushes with paranormal continue
16858	run ends for ohio man's secret santa bearing pies
16859	squeaker of a victory in hand, romney looks to nh
16860	stock futures down slightly after day of big gains
16861	pressures rises on embattled german president
16862	men get 14 and 15 years for uk black teen's murder
16863	firefighters pull back in fear of venomous snakes
16864	huntsman: republican race wide open in iowa's wake
16865	jordan upholds sentence for al-qaida mentor
16866	finland grants transit permit for patriot missiles
16867	rep 1/8ort: yahoo may name paypal exec as ceo
16868	militants raid yemen hotel serving alcohol, kill 2
16869	florida was weird as only it can be in 2011
16870	nkorea calls skorea president 'chieftain of evils'
16871	pope oks early resignation for california bishop
16872	hungary's currency at new low on lack of imf deal
16873	group reports christmas week sales surge
16874	bond market gives eurozone brief respite
16875	afghan leader welcomes taliban office in qatar
16876	democratic chair tweaks romney over narrow win
16877	calif. cities consider uniform plastic bag ban
16878	maldives president orders resort spas to reopen
16879	jan. 4 birthday runs in the family in ohio
16880	california bishop resigns, says he has 2 kids
16881	father hopes convicts will turn on other killers
16882	beckham designs underwear collection for h&m
16883	police: illinois man gouged uncle's eyes out
16884	mount rainier national park to reopen saturday
16885	bonnie and clyde guns to be auctioned in missouri
16886	vaclav havel's ashes buried in prague
16887	pa. woman pleads guilty in facebook slaying plot
16888	syrian troops seize control of strategic highway
16889	trump unveils new 'celebrity apprentice' crew
16890	escondido teachers awarded grants for innovative projects
16891	temporary campus ready for s.m. high students
16892	egypt prosecution: mubarak, aides ordered killing
16893	petition to repeal sj pot law qualifies for ballot
16894	polish art student hangs own painting in museum
16895	chrysler caps turnaround year with strong december
16896	school district fights bus mishap court decision
16897	bachmann cancels sc trip after poor iowa finish
16898	demolition of old san francisco jail set to begin
16899	jury decides death for mistaken identity killer
16900	feds seize bogus winter classic merchandise
16901	yahoo names paypal exec as its ceo
16902	killer whales spotted off southern california
16903	publisher: classical composer elliott carter, winner of 2 pulitzer prizes, dies in ny...
16904	sf transit officials want to reduce car use
16905	argentine leader undergoes thyroid cancer surgery
16906	yahoo names paypal exec as ceo
16907	not guilty plea for man accused in ind. girl death
16908	more than 950 protesters invade venezuelan prison
16909	on verge of retiring, frazar now in paradise
16910	la arson suspect under investigation in germany
16911	man sought in san diego motel slaying extradited
16912	roku expands beyond internet video-streaming boxes
16913	calif. catholic bishop resigns, says he has 2 kids
16914	ap sources: obama bucks gop, oks consumer watchdog
16915	mass. mom asks police to arrest bickering teens
16916	uk police warned: beware thirsty, flirty reporters
16917	suspected drunken driver hits several cars in serra mesa
16918	stocks down slightly after day of big gains
16919	liljenquist enters us senate race in utah
16920	san diego priest arrested for sexual assault
16921	police hunt gang members for street killing
16922	factory orders increased 1.8 percent in november
16923	metropcs to sell phones with tv tuners
16924	uconn launches search for new athletic director
16925	groupama wins 2nd-leg sprint in volvo ocean race
16926	iran closing house of cinema film center
16927	los angeles arson suspect probed in german fire
16928	indycar suffering through slumping tv ratings
16929	mass. pension board divests from iran businesses
16930	10news: hearing today for man accused of id theft
16931	texas cattle deaths tied to toxic bermuda grass
16932	torre quits mlb to pursue dodgers ownership
16933	ford's us sales rise 11 pct in 2011
16934	gm sales rise 13 percent in 2011
16935	china bus slides off snow-covered bridge, 16 dead
16936	swiss central bank publishes audit on its chief
16937	capsule reviews of `pariah,' `a separation'
16938	al-qaida suspect met sept. 11 figure in pakistan
16939	jacksonville state defeats alcorn state 63-52
16940	judge stops medi-cal budget cuts; state plans appeals
16941	canadian bishop gets 15 months in child porn case
16942	countdown to 2013: times square ball heads back up
16943	3 trash workers in redwood city taken to hospital
16944	judge stays order ousting ind. secretary of state
16945	2 held after random shooting
16946	ex-bank executive pleads guilty to mail fraud
16947	burlgar tunnels through wall into el cajon store
16948	iraq attacks kill 4 people amid political crisis
16949	police kill armed teenage student at texas school
16950	sect kills 3 despite state of emergency in nigeria
16951	us official: 1 in custody in houston shootings
16952	ford unveils brazil-designed car for world market
16953	new handgun regulation faces federal lawsuit
16954	uk experts: missing drug info could hurt patients
16955	perry tweets, `here we come south carolina'
16956	hugh jackman plans broadway return as houdini
16957	summary box: record losses from disasters in 2011
16958	bachmann quits race, says she'll fight for issues
16959	bachmann quits gop race; romney on to nh
16960	uproar over swiss central bank chief's dollar deal
16961	mariah carey says nick cannon has kidney failure
16962	using recess power, obama putting cordray in job
16963	lululemon up; added to goldman list of top picks
16964	americans bought more cars and trucks last year.
16965	forecast: german 2012 economy to grow 0.6 percent
16966	range rover boasts sleekest suv
16967	liz claiborne changing name to fifth & pacific
16968	police kill armed 8th-grader in texas school
16969	adviser says bachmann out of race; romney on to nh
16970	perry weighing whether to drop bid
16971	wade game-time decision with sore foot
16972	nadal, tsonga reach quarterfinals at qatar open
16973	delta air lines is getting into fuel business
16974	civil suit filed by teen in deputy sex case
16975	sf burglary suspect believed hiding on cliff
16976	ap names eric carvin social media editor
16977	going whole hog (fish and duck, too)
16978	arellano-felix to plead guilty wednesday
16979	ind. house dem leader hints at possible walkout
16980	police kill armed eighth-grader in texas school
16981	wis. cheese recalled due to possible contamination
16982	motorist faces murder trial for cyclist's death
16983	boeing to close wichita facility by end of 2013
16984	factory orders rise, but business investment slips
16985	fate of reno air races to be announced wednesday
16986	castle park neighborhood gets a chance
16987	nhl cancels september slate of preseason games
16988	dumanis calls news conference on south bay
16989	huge waves to hit south county hardest
16990	ny grocery changes course on alec baldwin tv ads
16991	young actors? theatre celebrates milestone
16992	ny philharmonic names new executive director
16993	party official says president to remain in yemen
16994	stocks flat after day of big gains
16995	police: illinois man gouges out uncle's eyes
16996	delta, lufthansa to hike prices to cover emissions
16997	argentine president awake, ok after cancer surgery
16998	conn. man gets 70 years for kidnapping ex-wife
16999	uss reagan to bremerton for year-long overhaul
17000	embattled german president sorry for editor call
17001	americans bought more cars and trucks in 2011
17002	market optimism tempered by european bank worries
17003	lose the game, win a title? maybe for lsu
17004	beaux barfield ready to rewrite indycar rules
17005	mexican cartel kingpin to plead guilty in us court
17006	santa monica chases away van for elderly
17007	judge: calif serial killer can be extradited to ny
17008	composite sketch released in city heights sex assault
17009	those charged by district attorney bonnie dumanis
17010	4 experts dispute report norway killer is insane
17011	2 dead in apparent murder-suicide near hemet court
17012	fla. ponzi schemer implicates many others in crime
17013	furor after nj hometown removes landon plaque
17014	fda limits some antibiotics in livestock
17015	review: readers reminded of forgotten countries
17016	2 uk white men sentenced for killing black teen
17017	summary box: eurozone inflation eases in december
17018	pursuit ends with parolee arrests
17019	obama bypasses senate, installs new consumer chief
17020	5 charged in san diego-area school corruption
17021	review: shark 360 mouse offers added precision
17022	oil price stays around $103 per barrel
17023	longtime parker volleyball coach returns to sidelines, eyes 17th section championship
17024	family: iran detainee needs better legal help
17025	tunisians call for end to campus veil standoff
17026	study: parasitic fly could explain bee die-off
17027	condo shooting ruled murders, suicide
17028	county, met clash over water rates
17029	nadal, federer reach quarterfinals at qatar open
17030	avoiding pirates, groupama wins ocean race leg
17031	artist ellen carey is pushing the boundaries of photography
17032	convicted polygamist leader's phone use suspended
17033	swiss central bank caves over chief's dollar deals
17034	now you see it, now you don't: time cloak created
17035	nyc resolution: attract 50m-plus tourists in 2012
17036	disney drops 4 mexican riviera cruises
17037	chile navy rescues solo us sailor in south pacific
17038	penn st. memos show funding fears, secrecy effort
17039	development barred in puerto rico coastal strip
17040	suspects in utah-nevada crime spree held in jail
17041	nh bill makes some insurance coverage optional
17042	boston cardinal marks 10th anniversary of crisis
17043	chile navy locates solo us sailor in south pacific
17044	cast named for play based on jayson blair scandal
17045	jimmy carter's latest book offers lessons in faith
17046	treasury prices lower on improved economic news
17047	entropic aims to buy assets from bankrupt chip firm
17048	singer of 'i'm your puppet' dies in florida at 72
17049	family taking $350k in vegas missing organs claim
17050	10 arrests, ton of pot seized on smuggler boat
17051	the 'songs to sing' in new rep show
17052	officials move ahead with plans for reno air races
17053	ny gov: $1b to buffalo as part of jobs program
17054	free seaworld pass among mall deals
17055	cuba criticizes twitter for fidel death rumor
17056	calif man accused of flying plane while drunk
17057	calif. lawmaker cited after tsa finds loaded gun
17058	official: reno air races on despite deadly crash
17059	tim rogers appointed ap news editor for carolinas
17060	la high school campus locked down on gun report
17061	sf police back off burglary suspect on cliff
17062	reading program gets $10,000 grant
17063	jerry seinfeld sells out (in a good way)
17064	perry leaving "quirky" iowa for south carolina
17065	some find hope in afghan outcry over bride's abuse
17066	report: kodak may file for bankruptcy
17067	ecuador plaintiffs seek chevron payment worldwide
17068	navy pilot killed self in san diego murder-suicide
17069	disney and comcast reach a long-term deal
17070	london olympic glitch creates oversold tickets
17071	police allege la man swung puppy 'like a yo-yo'
17072	orange juice futures rise as cold hits florida
17073	alpine fire district changes pension rules
17074	thompson brings tech background to yahoo
17075	dread april 15? this year, taxes due 2 days later
17076	wis. gop will hold mining hearing in north
17077	romney, santorum take on nh after virtual tie
17078	at least 26 killed in congo militia attack
17079	chile changes terminology for military government
17080	rapid redux wins 22nd straight race by 3/4 length
17081	eastlake players back on their game
17082	ind. house dems plan to stay out of session
17083	summary box: orange juice futures up on cold snap
17084	la auxiliary bishop resigns, admits fathering kids
17085	ri sentencing postponed for ga. man in navy case
17086	obama campaign casting president as promise keeper
17087	oil industry chief warns obama on canada pipeline
17088	last defendant in iraq war case to stand trial
17089	sentencing postponed for pa. corruption defendants
17090	alleged ohio 'pill mill' owner pleads not guilty
17091	pentagon to unveil plan guiding big spending cuts
17092	mexican cartel kingpin pleads guilty in us court
17093	google buys more patents from ibm
17094	brazil's former president undergoes radiation
17095	after iowa, romney now hopes to pull away in nh
17096	central valley tribe wins federal recognition
17097	trail camera photo appears to be wandering wolf
17098	review: dreamlike `pariah' shows teen's coming-out
17099	e-book sales top 5 million for james patterson
17100	3rd small earthquake recorded near sc coast
17101	5-year prison term for nj rabbi in corruption case
17102	posts available on solana beach commissions
17103	'potter,' 'x-men,' 'apes' vie for visual oscar
17104	cdc scientist: tests needed on gas drilling impact
17105	scripps mercy unveils larger er
17106	fda orders safety studies of women's surgical mesh
17107	libya army chief of staff wants to disarm fighters
17108	stock market ends mixed a day after big gains
17109	man banned from owning dog after puppy gets drunk
17110	around town in san diego
17111	free agency provides an opportunity for chargers
17112	ny gov seeks aqueduct convention center, casinos
17113	polian regrets not having backup plan for colts
17114	author lane van ham to talk about new immigration book thursday
17115	lawmaker declines to comment on shoplifting charge
17116	body found in freeway fire in san fernando valley
17117	new england journal: 200 years of medical history
17118	how consumer financial watchdog will expand powers
17119	los angeles arson suspect on suicide watch
17120	summary box: stocks barely move
17121	alleged gunman nabbed in killing of marysville man
17122	arpaio asks for facts to back up civil rights case
17123	wolf that crossed into calif. likely photographed
17124	local organizations are seeking volunteers
17125	kodak, ford, tivo, lululemon are big movers
17126	post-hillman era begins at sdsu
17127	survivor of deadly conn. home invasion is engaged
17128	eveland trial in vista continued to jan. 17
17129	antiques dealers to compete on pbs reality show
17130	court papers: nyc officer shooting suspect sorry
17131	4th small earthquake recorded near sc coast
17132	on wall st., it's not much, but it's two in a row
17133	violent decades surround burned abortion clinic
17134	vista pageants open for contestants
17135	stirring up a fight, obama names consumer watchdog
17136	german man charged in los angeles arsons
17137	what is a recess? constitution doesn't specify
17138	how the major stock indexes fared on wednesday
17139	audra mcdonald and will swenson are engaged
17140	sen. anderson edged out for gop leader
17141	controlled burn sends up smoke near pine valley
17142	the read: 'tiger's wife' author here
17143	lawmakers face budget strife, election challenges
17144	alleged victim's brother curses at bulger witness
17145	immigration digest: new year, new laws
17146	ind. house democrats stall session over labor bill
17147	officials moving ahead with 2012 reno air races
17148	police: oc homeless slayings work of serial killer
17149	americans expected to buy more cars in 2012
17150	closing: 5 macy's and 4 bloomingdale's stores
17151	martin's error costly in pirates' 4-3 loss to cubs page 1 of 2
17152	how much is yahoo worth? the case for buying
17153	police: man shoots wife, self, near hemet court
17154	tribal company to manage nj's resorts casino
17155	parole agent shot in los angeles
17156	meet san diego's head concierges
17157	orange county bishop to helm san diego diocese
17158	boeing to close wichita plant with 2,160 jobs
17159	bp oil spill payments to resume after fee wrinkle
17160	dc pay phone owner gets 3 months in $4m fraud case
17161	australia: no higher risk from french implants
17162	parole agent shot in la; manhunt closes freeway
17163	panel urges lower cutoff for child lead poisoning
17164	navy fires senior sailor at coronado bomb unit
17165	orange county bishop to lead san diego diocese
17166	former bears, cowboys receiver hurd indicted
17167	the game: tide and tigers roll into new orleans
17168	body of truckee boaster recovered from donner lake
17169	police: student killed by officers had pellet gun
17170	veteran trainer, jockey shirota is dead at age 78
17171	uk: fate of ransom payments to pirates unclear
17172	woman's survival in crime spree 'miraculous'
17173	uk's hague visits myanmar to urge reforms
17174	child bride's torture renews afghan rights worries
17175	10 new winter tv shows to watch
17176	ex-firefighter faces new sex charges
17177	column: tebow time has already come and gone
17178	actress zooey deschanel files for divorce in la
17179	feds: proposed insurance rate hikes 'unreasonable'
17180	texas police kill 8th-grader carrying pellet gun
17181	police: homeless slayings work of serial killer
17182	after quakes, owner to lower pressure in ohio well
17183	longtime navajo code talkers group president dies
17184	ap: nj voters may get say on internet gambling
17185	rep. giffords to attend tucson candlelight vigil
17186	heat star wade out against pacers with sore foot
17187	german man charged with arson in new year fires
17188	this weekend (jan. 5-8) in beer
17189	florida man reunites with lost kitty in colorado
17190	burglar accused of targeting senior citizens
17191	nm sending feisty chimp to california zoo
17192	landslide kills 25 in southern philippines
17193	new yahoo ceo can't afford to dawdle on to-do list
17194	man, 90, and burglar wounded in shootout
17195	a new push to limit csu presidents? salaries
17196	jobless rate now a leading political indicator
17197	3 warships named in honor of marines
17198	sdsu football looking to make 'strong' hire
17199	no. 3 notre dame women rout seton hall 74-36
17200	c. arnholt smith's old family home goes on the market
17201	da on sweetwater officials: ''they simply lied''
17202	ap source: marlins acquires zambrano from cubs
17203	seaport village remodel, marine thank you, brown's tax initiative
17204	us album sales rise for first time since 2004
17205	alaska village votes yes on school relocation
17206	police arrest 3 in merced county double homicide
17207	body of truckee boater recovered from donner lake
17208	austrian military to use surveillance drones
17209	no. 9 georgetown beats no. 20 marquette 73-70
17210	wyatt sparks temple to 78-73 win over no. 5 duke
17211	east county driver gets top nationwide ride
17212	la parolee captured after hours-long manhunt
17213	howard, magic run past winless wizards, 103-85
17214	aussie kidnapped in philippines seeks $2m ransom
17215	ap source: marlins acquire zambrano from cubs
17216	sweetwater suspends bond program manager
17217	parent activists vs. unions over school law
17218	31 inmates killed in northern mexico prison fight
17219	no. 19 murray state beats e. kentucky 76-67
17220	white lifts ksu women over aggies 71-69 in ot
17221	clemson, west virginia start fast at orange bowl
17222	bulls beat pistons 99-83 in hamilton's return
17223	bergeron scores 2 goals in bruins' rout of devils
17224	lisicki bows out in auckland with back injury
17225	sd council president ponders staduim, new city hall
17226	ny judge: no lives left for cat litter commercial
17227	romney working on building wide margin in nh vote
17228	seton hall women fall short against no. 3 irish
17229	sims, griner lead no. 1 baylor women over mizzou
17230	eller's 5 points lead canadiens over jets
17231	no. 14 kansas beats no. 23 k-state 67-49
17232	4 men arrested by child pornography task force
17233	asia stocks mixed after flat wall street trading
17234	okla. mom won't face charges for shooting intruder
17235	china bus slides off snow-covered bridge; 18 dead
17236	without wade, heat rout pacers 118-83 behind james
17237	extended training camp for sdsu hoops
17238	west virginia running past clemson at orange bowl
17239	texas tech women top oklahoma state, move to 13-0
17240	nj river bridge opens, gets stuck; trains stopped
17241	running team by popular vote not as easy as it looks
17242	west virginia women fall to no. 2 uconn 79-60
17243	top-ranked syracuse holds off providence 87-73
17244	eku rallies, but falls at no. 19 murray state
17245	no. 20 marquette loses to no. 9 georgetown 73-70
17246	holiday scores 23 as 76ers beat hornets 101-93
17247	crowds marvel at oahu north shore waves
17248	pakistani militants kill 15 security officers
17249	swank sushi: tuna fetches record $736k in tokyo
17250	chinese companies battle over internet video
17251	goodrich leads kansas women over no. 23 texas
17252	west virginia running over clemson at orange bowl
17253	schiavone into semifinals at brisbane
17254	harrington, fernandez lead nuggets' rout of kings
17255	white house announces summer jobs initiative
17256	kin of conn. fire victims thankful for compassion
17257	spithill steers oracle to big race 9 win
17258	stuck nj river bridge fixed, train service resumes
17259	san diego hospital settles lawsuit on immigrants
17260	ap interview: malaysian in sodomy trial slams law
17261	torreys stand tall against elite teams
17262	west virginia routs clemson 70-33 in orange bowl
17263	pc honors gavitt before loss to no. 1 syracuse
17264	police: 6 officers wounded in ogden shooting
17265	top musical acts to headline super bowl party
17266	paul, griffin help clippers rout rockets 117-89
17267	canucks' luongo blanks wild in his 700th nhl game
17268	princeton review to sell test prep business, name
17269	twin explosions in shiite area of baghdad kill 6
17270	fabled frigate curts leaves fleet
17271	oil hovers near $103 amid mixed us supply signs
17272	twin explosions in baghdad kill 6
17273	explosions in shiite areas of baghdad kill 13
17274	wild elephant tramples 3 to death in se nepal
17275	cambodia anti-drug chief sentenced for corruption
17276	celeb birthdays for the week of jan. 8-14
17277	bookkeeper gets 2 years for stealing $70,000
17278	gas station robbed in san ysidro
17279	fiat gets another 5 percent of chrysler
17280	israel shelves contentious bill on choosing judges
17281	explosions in shiite areas of baghdad kill 23
17282	jury reaches verdict in jodi arias trial
17283	elderly pedestrian killed by car identified
17284	one year on, no answers to egypt church bombing
17285	man gets 12 years in prison for green energy scam
17286	sexual battery case dropped against border agent
17287	top celebrity stories of the week
17288	research flips on career light for student
17289	shooting victim found in valencia park
17290	the beginning of the end
17291	improving student success at community colleges
17292	how the poll was conducted
17293	euthanasia to control shelter population unpopular
17294	two role models show what is possible
17295	with 5 days to go, gop rivals in race for money
17296	hard work pays for middle school student
17297	wildfires on blackfeet res. force evacuations
17298	obama unveiling strategy for slimmed-down military
17299	chilean navy finds solo us sailor in south pacific
17300	west virginia drubs clemson 70-33 in orange bowl
17301	at 75, marion barry gears up for another campaign
17302	landslide kills 25, buries more in philippines
17303	ex-israeli leader olmert accused of bribe-taking
17304	trains expected normal after nj river bridge fixed
17305	china calls on europe for talks over carbon charge
17306	'bama out to prove it's no. 1 in rematch with lsu
17307	woodland starts new year with big changes
17308	afghan official gunned down on way to mosque
17309	former kate middleton choose her charities
17310	philippines doubles bounty on fugitive ex-general
17311	police break up fuel protest in north nigeria
17312	us and skorea discuss leadership change in nkorea
17313	show of works by bill traylor to debut in atlanta
17314	ex-israeli leader olmert accused of seeking bribes
17315	oil hovers below $103 amid mixed us supply signs
17316	india's anti-corruption hero sees popularity fade
17317	syria releases 552 political prisoners
17318	former kate middleton chooses her charities
17319	world stocks mostly lower on eurozone worries
17320	6 officers, suspect wounded in utah drug shooting
17321	la arson suspect also faces german fire probe
17322	china's dragon stamp breathes criticism, fear
17323	explosions in shiite areas of baghdad kill 27
17324	high water in north spark dutch evacuations
17325	ca court to mull expiration date for clergy abuse
17326	la auxiliary bishop's resignation elicits shock
17327	pursuit of mexican drug kingpin draws to quiet end
17328	scott, ross start, star for no. 11 osu
17329	us arson suspect also faces german fire probe
17330	a brief history of stephen hawking
17331	myanmar approves suu kyi's party for election
17332	hearing reveals divisions over gettysburg casino
17333	norristown'sbus-boom hopes hit a speed bump
17334	high schools - captain greene is the perfect ambassador for bodine
17335	sam donnellon: both bullpens strong up the middle
17336	those responsible in fatal burning of dog sought
17337	unionville-chadds ford district taps new chief
17338	cheap dinners; cutting card rates
17339	specter draws fire from right on stimulus
17340	sam donnellon: phillies pitcher blanton is dream coming true
