9332	sunday feature: a brief history of cunning
9333	olympics - all programmes - page 1
9334	house of saddam: episode 3
9335	will women boost japan's gdp?
9336	edinburgh film festival's hannah mcgill stands down
9337	malmo tie far from over, says rangers boss mccoist
9338	life on one of the world's most remote islands
9339	asian airlines feel oil squeeze
9340	today - hsbc 'has to be more efficient'
9341	what prospects for the young unemployed?
9342	firefighters rescue boy with head stuck in toilet seat
9343	mark watson makes the world substantially better: series 2: generosity
9344	blood and guts: a history of surgery: bleeding hearts
9345	the tudors: series 2: episode 5
9346	drama on 3: your only man
9347	the conspiracy files: series 2: lockerbie
9348	whose side is bart simpson on?
9349	mock the week: series 6: episode 9
9350	tennis - keothavong and smith lose in danish open semi-finals
9351	cricket - india beat sri lanka by an innings to top test rankings
9352	the novel that changed my life: episode 6
9353	osaze odemwingie rallies nigeria's super eagles
9354	they came from manchester: the story of mancunian pop
9355	the wrong door: the smutty aliens
9356	amazon with bruce parry: episode 1
9357	the dark side of fame with piers morgan: jim davidson
9358	cbeebies - all programmes - page 1
9359	football - holders chelsea wait for cup draw
9360	live - ulster v glasgow
9361	the king's speech wins 14 bafta nominations
9362	cricket - england to lodge umpire protest
9363	jimi hendrix: made in london
9364	james may's big ideas: come fly with me
9365	schools accused of anti-gay language in sex education
9366	little britain usa: episode 1
9367	woman's hour drama: the color purple: episode 1
9368	the american future: a history, by simon schama: american plenty
9369	little britain usa: episode 2
9370	brownsea island is renamed for comic relief 2011
9371	stephen fry in america: new world
9372	drama on 3: the duchess of malfi
9373	the mobo awards: 2008: 15/10/2008
9374	heroes: series 3: one of us, one of them
9375	joe strummer's last recorded concert
9376	heroes: series 3: i am become death
9377	the loneliness of the goalkeeper
9378	theme time radio hour with bob dylan: 30/10/2008
9379	the fourth, the fifth, the minor fall
9380	top gear: series 12: episode 3 (new series)
9381	wild about your garden: tales from the riverbank
9382	ashburton service remembers crash victims
9383	top gear: series 12: episode 4 (new series)
9384	huge coin haul stolen from bus depot
9385	the political studies association awards 2008
9386	classic serial: the hunchback of notre dame: episode 1
9387	louis theroux: law and disorder in philadelphia
9388	book at bedtime: black orchids: episode 10
9389	masked youths hurl bricks at ellesmere port police
9390	heroes: series 3: our father
9391	lark rise to candleford: series 2: episode 1
9392	chief inspector of prisons urges jail remand overhaul
9393	top gear: series 12: episode 8 (new series)
9394	around the world in 20 years
9395	the real italian job: james martin's mille miglia
9396	adolf hitler: my part in his downfall: episode 4
9397	jonathan creek: the grinning man
9398	the secret life of elephants: episode 1
9399	panorama: what now, mr president?
9400	search results for newsnight scotland
9401	poor weather halts search of south korea sunken warship
9402	panorama: have i got bad language for you?
9403	it's time to go nationwide
9404	comedy - all programmes - page 1
9405	football - falmouth town discuss a ground share with truro city
9406	latest rock & indie releases
9407	casey stoney column: england players can handle pressure
9408	latest classic pop & rock releases
9409	'i just launched' - pope benedict sends first tweet
9410	new base opened for north devon air ambulance
9411	french library finds leonardo da vinci manuscript
9412	from our own correspondent: 07/02/2009
9413	world book club: world book club: episode 1
9414	the monday documentary: fresh start: episode 2
9415	natural world: great white shark - a living legend
9416	manila police admit bungling deadly bus siege
9417	nature's great events: the great melt
9418	factual - all programmes - page 1
9419	man guilty of sexually abusing four-year-old niece
9420	the friday documentary: beatles in the ussr: episode 1
9421	world, have your say: 13/02/2009
9422	scrum v: 2008/2009: six nations special
9423	classic serial: scoop: episode 1
9424	no growth in uk industrial output
9425	danny collins expecting stoke city departure
9426	mad men: series 2: flight one
9427	ride with the devil: the gene vincent story
9428	nature's great events: the great salmon run
9429	football - friday's gossip column - transfers and rumours
9430	chemical computer that mimics neurons to be created
9431	world, have your say: 24/02/2009
9432	the wednesday documentary: indonesian journeys: episode 1
9433	world, have your say: 25/02/2009
9434	classic serial: scoop: episode 2
9435	mad men: series 2: the benefactor
9436	world, have your say: 26/02/2009
9437	surfer dies in australia shark attack
9438	how declan kelly helped bring us investment to ni
9439	history - themes - saint david
9440	religious tv host pat robertson wants pot legalised
9441	from our own correspondent: 28/02/2009
9442	2012 olympic games plans unaffected by rioting in london, boa claims
9443	u-turn in north norfolk dudgeon wind farm cable decision
9444	world, have your say: 03/03/2009
9445	saturday play: the complete ripley: the talented mr ripley
9446	could ivory coast turmoil make chocolate more expensive?
9447	afternoon play: the state of the art
9448	uproar over china's 'angry dragon' stamp
9449	assignment: rating the credit rating agencies
9450	one planet: return of the nomad: episode 2
9451	world, have your say: 05/03/2009
9452	search results for being human
9453	the friday documentary: public places, private lives: episode 1
9454	ten minute rule bill: airport expansion (parliamentary approval) bill
9455	jimmy doherty in darwin's garden: dangerous ideas
9456	derbyshire man creates olympics fourth place medal
9457	heroes: series 3: trust and blood
9458	saturday play: the complete ripley: ripley under ground
9459	snow business: how technology helps firms beat weather
9460	global business: the cisco kid
9461	delay in replacing injured michu 'defining moment' says williams
9462	charlie gillett's world of music: 07/03/2009
9463	galleon insider trading case hears final defence pleas
9464	the monday documentary: third agers: episode 1
9465	the monday documentary: third agers: episode 2
9466	boston mayor: suspect may never be questioned
9467	comic relief: harry and paul - dragons' den
9468	car crashes into bank during raid
9469	police forces pledge to merge services
9470	timewatch: 2008 - 2009: the real bonnie and clyde
9471	world, have your say: 09/03/2009
9472	thalidomide survivors receive government apology
9473	football - live - wednesday football
9474	the wednesday documentary: indonesian journeys: episode 3
9475	nissan decision 'statement of confidence in uk economy'
9476	world, have your say: 11/03/2009
9477	one planet: the yortanli dam: episode 1
9478	erica bodman hopes to impress british rowing selectors
9479	the friday documentary: yiddish - a struggle for survival: episode 1
9480	us expands sanctions on iran, targeting oil and media
9481	walsall campaigners celebrate caldmore village status
9482	mr men fail to switch on pontypool lights
9483	merkel praises eurozone deal to help greece
9484	charlie gillett's world of music: 14/03/2009
9485	football - port vale v northampton
9486	world, have your say: 16/03/2009
9487	nadine labaki releases film about lebanese women
9488	the wednesday documentary: indonesian journeys: episode 4
9489	horizon: 2008-2009: who do you want your child to be?
9490	prestatyn club's 12-day closure to remove asbestos
9491	john terry vows to clear his name after racism charge
9492	atl - do you remember the first time?
9493	baseball and me: episode 2
9494	barry robson 'exemplary' for middlesbrough - tony mowbray
9495	rugby union - two england six nations matches to be shown in 3d
9496	saturday play: the complete ripley: the boy who followed ripley
9497	from our own correspondent: 21/03/2009
9498	charlie gillett's world of music: charlie gillett's world of music
9499	the monday documentary: third agers: episode 4
9500	football - chairman quits as distillery face winding-up petition
9501	death of jane cumming treated as murder
9502	manchester rail link welcomed as a 'boost' to region
9503	third reich & roll: episode 2
9504	barry hearn in pledge over olympic stadium battle
9505	new zealand's dan carter suffers injury scare ahead of wales clash
9506	football - bougherra call-up concerns smith
9507	the strand: the strand - tuesday 25th march 2009
9508	rugby union - dan parks eyes world cup role for scotland
9509	the apprentice: series 5: episode 1
9510	assessment of 'canvas' proposals - public consultation by the trust
9511	joiner's lottery win 'will pay for knee operation'
9512	saturday play: the complete ripley: ripley under water
9513	the night the government fell: a parliamentary coup
9514	bodies of five suspected militants found in pakistan
9515	baroque! - from st peter's to st paul's: episode 3
9516	exeter car chase driver was 'escaping aliens'
9517	horne and corden: episode 4
9518	i've never seen star wars: rory mcgrath
9519	snog marry avoid?: series 2: episode 7
9520	david lean in close-up with jonathan ross
9521	arts, classical and jazz zone: 02/04/2009
9522	the friday documentary: culture not colour: episode 1
9523	unionists object to sale of nie to irish republic's esb
9524	mp challenges nottingham's decent homes funding cuts
9525	how woolies became wellies: one woman's fight for the high street
9526	top dogs: adventures in war, sea and ice: cape horn
9527	football - man utd pair o'shea and evans out injured until january
9528	episode detail: marc riley: 02/04/2009
9529	'cosmonauts' ready for mars test
9530	episode detail: gilles peterson: 02/04/2009
9531	episode detail: gardeners' world: 2009: episode 1
9532	times and sunday times digital subscriptions rise
9533	episode detail: the real swiss family robinson: the busbys in panama
9534	episode detail: performance on 3: bavarian radio so/janssons
9535	us senators prepare for next vote on health bill
9536	flu jabs during pregnancy 'help protect child'
9537	episode detail: the chris moyles show: 02/04/2009
9538	ebbsfleet united keeper preston edwards out for season
9539	india launches scientific expedition to south pole
9540	episode detail: the now show: series 26: episode 5
9541	chilcot pushes iraq inquiry secrecy button
9542	episode detail: the chris moyles show: 03/04/2009
9543	south west trains passengers told not to travel
9544	the interview: shahubiddin yakub quraishi
9545	film 2009 with jonathan ross: episode 10
9546	eggheads: series 10: episode 9
9547	japan: a story of love and hate
9548	friday night with jonathan ross: series 16: episode 10
9549	prostate cancer drug abiraterone approved by scottish medicines consortium
9550	tennis - itf clears yanina wickmayer and xavier malisse to play
9551	halloween artist carves pumpkins into the death star
9552	the strand: the strand - friday 3rd april 2009
9553	world book club: world book club: kate grenville: episode 1
9554	letter from...: letter from india
9555	football - chesterfield 5-2 accrington
9556	the financial lessons of southern cross
9557	jack mcconnell to quit as an msp
9558	being human: series 1: episode 5
9559	andre previn: all the right notes
9560	nicky hayden fastest as rain hampers motogp test at jerez
9561	'match-fixing' south korean footballers banned for life
9562	i've never seen star wars: emily maitlis
9563	business daily: black empowerment in south africa
9564	specialist team for rape victims
9565	film 2009 with jonathan ross: episode 11
9566	the book quiz: series 3: episode 10
9567	snog marry avoid?: series 2: episode 8
9568	leeds hotel emails kent castle image in error
9569	the strand: the strand - tuesday 7th april 2009
9570	all the small things: episode 1
9571	timewatch: 2008 - 2009: in shackleton's footsteps
9572	discovery: oceans - what lies beneath: episode 2
9573	world, have your say: 08/04/2009
9574	school shuts over swine flu fears
9575	frank moore jailed for stewart taylor murder
9576	the culture show: 2009/2010: episode 18
9577	biden and ryan clash over syria
9578	cardinals dolan and mahony quizzed on child abuse
9579	the apprentice: you're fired: series 5: episode 3
9580	le pen among euro rightists to visit japan wwii shrine
9581	the strand: the strand - thursday 9th april 2009
9582	the friday documentary: keeping the peace: episode 1
9583	guernsey pedestrian in intensive care after taxi crash
9584	gaelic games - tyrone 1-13 0-13 donegal
9585	monks reject buckfast wine link to crime in scotland
9586	port staff in harwich and tilbury strike over pensions
9587	heart and soul: heart and soul
9588	doctor who confidential: desert storm
9589	two pints: fags, lads and kebabs
9590	film 2009 with jonathan ross: episode 12
9591	american freed by north korea arrives back in us
9592	xeroderma pigmentosa means alex, 15, must shun the sun
9593	the friday documentary: keeping the peace: episode 2
9594	eggheads: series 10: episode 18
9595	a question of genius: episode 25
9596	my life as an animal: pigs
9597	horne and corden: episode 6
9598	snog marry avoid?: series 2: episode 2
9599	eggheads: series 10: episode 19
9600	horo gheallaidh: series 1: episode 1
9601	4 better 4 worse: the anatomy of a string quartet
9602	snog marry avoid?: series 2: episode 6
9603	opposition attack on draft budget for wales
9604	two rearrested over guildford pensioner fire death
9605	mark lawson talks to: mike leigh
9606	snog marry avoid?: series 2: episode 3
9607	formula 1: 2009: the chinese grand prix
9608	louis theroux: a place for paedophiles
9609	the omid djalili show: series 2: episode 1
9610	two pints of lager and a packet of crisps: series 8: d.i.v.o.r.c.e.
9611	snog marry avoid?: series 2: episode 9
9612	gavin and stacey: series 1: episode 2
9613	football - fifa will not rule on ghana fa election sage
9614	is the jetpatcher a solution to our pothole nightmare?
9615	the thick of it: the rise of the nutters
9616	discovery: oceans - what lies beneath: episode 4
9617	kempsey flood defence work starts after skeletons moved
9618	enforced removal report handed to home office
9619	miliband aims to win back swing voters in east midlands
9620	mad men: series 2: the jet set
9621	colonel tells of lavish shopping for n korea dictators
9622	carlos tevez contests manchester city fine with premier league
9623	i've never seen star wars: david davis
9624	5 live sport: 5 live sport: london calling: london calling
9625	brendan rodgers admits championship play-off delay fear
9626	bendy buses begin month-long trial on manx roads
9627	my family: series 9: dog dazed
9628	english heritage: a very grand design (apethorpe)
9629	shots fired at man leaving east belfast club
9630	business weekly: capitalism and light bulbs
9631	the strand: the strand - friday 24th april 2009
9632	the interview: tne interview with c.k prahalad
9633	more genetic links to osteoarthritis uncovered
9634	world, have your say: 24/04/2009
9635	eggheads: series 10: episode 24
9636	queens of british pop: episode 1
9637	woman arrested over plymouth business break-in
9638	queens of british pop: episode 2
9639	friday night with jonathan ross: series 16: episode 12
9640	eric clarke receives bomber command clasp on 100th birthday
9641	something understood: yearning to be heroes
9642	the chris evans breakfast show: frankie dettori joins us for breakfast
9643	scotland prop geoff cross extends edinburgh stay
9644	luis suarez: fa charges liverpool striker for biting ivanovic
9645	analysis: obama and the cia
9646	the blagger's guide to bob dylan
9647	ted hughes poem on sylvia plath's death published
9648	world, have your say: 27/04/2009
9649	have i got news for you: series 37: episode 1
9650	gavin and stacey: series 1: episode 3
9651	celtic zone: bob dylan special
9652	ashes to ashes: series 2: episode 2
9653	glasgow papal pilgrims told to use public transport
9654	tourists flock to 'jesus's tomb' in kashmir
9655	china's leaders meet to plan economic future
9656	football - bournemouth boss eddie howe rejects southampton move
9657	panorama: baby p - the whole truth?
9658	devon children's centres in 'payment by results' trial
9659	guantanamo inmates to be sent to illinois prison
9660	shrewsbury permit parking warning over elton john gig
9661	ashes to ashes: series 2: episode 4
9662	youth hostelling: the first 100 years
9663	heroes: series 3: an invisible thread
9664	10 things you need to know about sleep
9665	south pacific: series 1: ocean of islands
9666	horizon: how violent are you?
9667	afternoon play: rumpole and the penge bungalow murders: old unhappy far-off things
9668	south pacific: series 1: endless blue
9669	free radio: brmb and sister station changes 'strange'
9670	the incredible human journey: europe
9671	who's watching you?: episode 1
9672	saturday play: the complete smiley - a murder of quality
9673	the championship: 2008/09: tyrone v armagh
9674	kate adie returns to tiananmen square
9675	stevenage sacking puzzles former boss gary smith
9676	dylan alkins family 'crushed' by loss of swept away boy
9677	that mitchell and webb look: series 3: episode 1
9678	the sky at night: neighbourhood watch
9679	children who use technology are 'better writers'
9680	hundreds to attend terry newton's funeral in wigan
9681	james simister charged with wife's murder in amesbury
9682	top gear: series 13: episode 1 (new series)
9683	google to open first latin america data centre in chile
9684	cultura y sociedad - un prodigio del pop
9685	cultura y sociedad - los altibajos de michael jackson
9686	pakistan's 'memogate' bodes ill for zardari
9687	football - norwich chief mcnally unhappy at investment speculation
9688	ashes to ashes: series 1: episode 7
9689	dancehall with robbo ranx: 25/06/2009
9690	this world: the madoff hustle
9691	rangers hat-trick scorer kyle lafferty in dreamland
9692	crude britannia: the story of north sea oil: episode 2
9693	on thin ice: episode 1
9694	f1 - martin brundle & david coulthard to be f1 commentators
9695	the best job in the world
9696	glastonbury: 2009: day 1 highlights: part two
9697	dozens of storm-battered seal pups rescued by rspca
9698	that mitchell and webb look: series 3: episode 4
9699	toyota agrees to pay $16.4m fine
9700	that mitchell and webb look: series 3: episode 3
9701	the pickwick papers: trials and tribulations
9702	million dollar traders: make me a trader
9703	the adventure show: 2008/2009: world cup mountain
9704	money programme: bill gates: how a geek changed the world
9705	can i get high legally?
9706	the addictions of sin: wh auden in his own words
9707	musical migrants: series 2: spain
9708	matt smith drops in on doctor who theatre show
9709	ludwig koch and the music of nature
9710	the world according to robert burns: 27/06/2009
9711	afternoon reading: berlin: berlin diary (winter 1932-33)
9712	between the ears: weather reports you
9713	grant is a 'lifeline' for lapwings at middleton lakes
9714	torchwood: children of earth: day one
9715	cult - the hitchhiker's guide to the galaxy
9716	qi: series 5: eyes and ears
9717	university challenge: 2009/2010: episode 1
9718	rowing world cup: 2009: lucerne highlights
9719	classic serial: the complete smiley - the spy who came in from the cold: episode 2
9720	richard dimbleby lecture: facing the future
9721	internacional - rupert murdoch, el poder y las sombras
9722	take on the takeaway: jean-christophe novelli
9723	council tells bath school to 'admit boys or close'
9724	cycling - french judge issues arrest warrant for floyd landis
9725	sebastian vettel: four-time f1 world champion
9726	how social media changed protest
9727	rick stein's far eastern odyssey: episode 1
9728	things to do in herefordshire & worcestershire
9729	what's really in our food?
9730	cricket - salman butt concerned by pakistan fielding errors
9731	richard hammond's engineering connections: series 1: super jumbo - a380
9732	john lennon's killer set for seventh parole hearing
9733	archbishop of wales in 'significant change' warning
9734	open lab - web 2.0
9735	stephen fry and the gutenberg press
9736	twiggy's frock exchange: episode 1
9737	the city uncovered with evan davis: banks and how to break them
9738	days that shook the world: series 1: hiroshima
9739	the conspiracy files: series 2: 7/7
9740	the alistair cooke memorial lecture 2008
9741	panorama: the battle of swat valley
9742	panorama: will the scots ever be happy?
9743	panorama: obama and the ayatollah
9744	america, empire of liberty omnibus: the impotence of omnipotence
9745	panorama: is your mp working for you?
9746	obama's nobel peace prize protocol breach irks norway
9747	quiz of the week's news
9748	storyville: 2008-2009: the trials of oppenheimer
9749	who do you think you are?: series 7: chris moyles
9750	hardtalk: sir martin sorrell - chief executive officer, wpp
9751	space force: series 1: threshold of stars
9752	imagine: annie leibovitz - life through a lens
9753	liverpool striker craig bellamy interests cardiff city
9754	formula 1: 2009: the hungarian grand prix - qualifying
9755	new tricks: the war against drugs
9756	david attenborough's life stories: dragons
9757	outnumbered: series 2: episode 2
9758	rob da bank and friends: 65daysofstatic v jonsi from sigur ros
9759	the story of maths: the language of the universe
9760	boob job: my big decision
9761	football - leyton orient snap up spurs midfielder tommy carroll
9762	nick williams says he is enjoying life on and off the pitch with ulster
9763	the reith lectures: the reith lectures: episode 1
9764	scottish fishermen boycott faroe meeting over mackerel
9765	who do you think you are?: series 7: kate humble
9766	natural world: 2008-2009: a farm for the future
9767	today at the open: 2008: day 1 highlights
9768	storyville: 2009-2010: gonzo: the life and work of dr. hunter s. thompson
9769	new nation: chips and chopsticks
9770	fitch revises outlook on france to 'negative'
9771	bang goes the theory: series 1: episode 1
9772	learn welsh the big welsh challenge - cerys's welsh cakes
9773	football - blackburn v west brom
9774	french aid worker laurent maurice released in chad
9775	cult - star trek - nichelle nichols - whoopi goldberg
9776	rivers with griff rhys jones: north
9777	five anglican bishops join catholic church
9778	glastonbury: 2009: black eyed peas & the prodigy
9779	man killed helping crash motorist
9780	veteran photographer warren faidley explains his craft as a 'storm chaser'
9781	glastonbury: 2009: the best bits: part 2
9782	syria: fear and hunger amid battle for aleppo
9783	glastonbury: 2009: day 3 highlights: part one
9784	glastonbury: 2009: day 3 highlights: part two
9785	glastonbury: 2009: day 3 highlights: part five
9786	the incredible human journey: asia
9787	cricket: twenty20 world cup: 2009: day 15
9788	rics concerned about regulation of the rental market
9789	rugby league - time for an act of union?
9790	is india star-crossed in asian space race?
9791	the story of maths: the genius of the east
9792	rivers with griff rhys jones: west
9793	louis theroux - the city addicted to crystal meth
9794	inside the virtual anthill: open source means business
9795	fry's english delight: so wrong it's right
9796	who do you think you are?: series 7: kim cattrall
9797	how to be a gardener part two - virtual garden
9798	6 music plays it again: lee 'scratch' perry: episode 1
9799	nasa selects insight mars mission after curiosity rover
9800	motor city's burning: detroit from motown to the stooges
9801	'zero viewers' for welsh tv shows
9802	iran nuclear expert buried as russia warns on sanctions
9803	the cell: the hidden kingdom
9804	panorama: the truth about happy hour
9805	bang goes the theory: series 1: episode 3
9806	in new movies we trust: quentin tarantino special
9807	patrice evra to pursue luis suarez allegations
9808	business daily: the risks of cloud computing
9809	deforestation in africa's congo basin rainforest slows
9810	future of food: episode 1
9811	luxury boat building industry thriving despite economic climate
9812	internacional - cia "contrat?" a blackwater contra al-qaeda
9813	rugby union - sonny bill williams to make all blacks debut v england
9814	holidays cancelled as travel firm allbury collapses
9815	doctor who greatest moments: the doctor
9816	history - themes - myths and legends - the mabinogion
9817	the movie that changed my life: suzanne vega: funny face
9818	rivers with griff rhys jones: east
9819	great lives: series 19: john cornford
9820	manchester marathon security reviewed after boston blasts
9821	fossilised spider 'biggest on record'
9822	world pipe band championships: 2009
9823	clifton downs group criticised over bristol zoo visitor parking license
9824	essex 'top' for teacher training
9825	nestle in chinese medicine deal with li ka-shing's firm
9826	the frankincense trail: oman, yemen and saudi arabia
9827	the breakfast show with joanne good and paul ross: 26/08/2009
9828	the craig charles funk and soul show: 22/08/2009
9829	internet service provider ripwire closes
9830	1,000mph bloodhound car will need superwheel
9831	angola grounds boeing 777 planes
9832	snooker - masters final - latest score
9833	northern not meeting 999 target says inspector
9834	formula 1: 2009: the belgian grand prix: part 1
9835	the strand: the strand - monday 24th august 2009.
9836	the office: series 1: episode 1
9837	that mitchell and webb sound: episode 1
9838	cultura y sociedad - arranca la 66? mostra de venecia
9839	virgin cooks: student v student
9840	future of food: episode 3
9841	the tudors: series 3: episode 3
9842	this world: gypsy child thieves
9843	george harrison: what is life
9844	cultura y sociedad - los beatles a la hora del juego
9845	would i lie to you?: series 3: episode 4
9846	journey of a lifetime: the sinking islands
